PRODUCT_NAME,CATEGORY,PRICE,PRODUCT_ID
"SAHASTRA Dream Catcher Hand Made for Positive Vibes, Wall Decor and car Hanging Made with Acrylic Material of Feathers (TR",Home Decor,899,PRD11389
"Apka Mart The Online Shop Lord Ganesh Oval Plate Metal Wall Hanging -16 Inch - for Home Décor , Brown",Home Decor,2800,PRD11390
"Store Indya Storeindya Wood Specs Stand Showpiece, (6.5 Inch, Brown)",Home Decor,299,PRD11391
"ArtX Kitchen Spices Motivational Funny Quotes, Wall Art Painting Framed Posters, 20 X 20 inches, 10.0 X 10.0 inches Each, ",Home Decor,1399,PRD11392
Paperiva Aluminum Dream Catcher (Blue),Home Decor,500,PRD11393
"ScentRose Incense Stick Holder Agarbatti Stand with Dhoop Holder and Ash Catcher (Stainless Steel, Cylindrical)",Home Decor,499,PRD11394
"Giant Innovative Wall Decor Funny Poster (250 GSM Paper, Multicolour, 12 x 18 Inch)",Home Decor,299,PRD11395
@Home by Nilkamal Sleek Table Clock (Gold),Home Decor,1399,PRD11396
Naayaab Craft Wooden Agarbatti Incense Stick Box Holder Dhoop Stand Ash Catcher - for Medium Size Agarbatti(Rectangular),Home Decor,699,PRD11397
"Parag Fragrances Golden Javadhu Dhoop Sticks 200 gm Monthly Pack (No Charcoal, No Bamboo, Hand Crafted, Long Lasting Dhoop",Home Decor,399,PRD11398
UMA Creation Wooden Wall Mounted Hanging Puja Temple Stylish Wood God Stand for Pooja Room Mandir Stand Temple  Home Temp,Home Decor,699,PRD11399
Hem Jewels 999 Pure Silver Radhe Krishna Frame for Gift and Home Décor (5 x 6 Inches),Home Decor,1000,PRD11400
HOKIPO® Eco-Friendly Bamboo Wooden Coasters for Home Pan Pot Holder for Dining Table Heat Pad for Kitchen - Pack of 4 (AR2,Home Decor,399,PRD11401
"wolpin Wall Stickers DIY Wallpaper (45 x 500 cm) Abstract Rhombus Modern Decal Office Restaurants, Home and Living Room De",Home Decor,1499,PRD11402
"Spectro 8 Pcs Flexible Mirror Sheets,12 x 12 Inches Mirror Tiles Self Adhesive Square Cuttable Mirror Wall Stickers Non Gl",Home Decor,1699,PRD11403
Decopix ac Sticker Fridge Sticker Wall Sticker Split Ac Stickers Air Conditioner Sticker - Standard Size (Fit for All Mod,Home Decor,499,PRD11404
SAREE HOUSE 10 Inch Metal Analog Vintage Railway Station Antique Style Double Sided Wall Clock (Black),Home Decor,2599,PRD11405
HEM Madhur Incense Sticks  6 in One Assorted Fragrance Agarbatti Pack of 2 (480g)  Ziplock Packet  Fragrances - Sandal,Home Decor,250,PRD11406
"AD INFINITUM Wall Decor 300gsm Matte Paper Posters (Marvel Logo_3, 9x13 Inch), Set of 8 (Multicolor)",Home Decor,999,PRD11407
"Amazon Brand - Solimo 3 Oz Jar Candles, Pack of 3 (Scented - Rose, Jasmine & Lavender, Wax)",Home Decor,500,PRD11408
"Freny Exim 10"" Inch Wooden Wall Clock (Wenge, Small Size, 25cm x 25cm)-028",Home Decor,1499,PRD11409
Pure Source India Aroma Reed Diffuser Refill Rose 100ML.And 8 Pcs Reed Sticks Coming Free With It,Home Decor,999,PRD11410
SAF Set of 3 Flower UV Coated 6MM MDF Home Decorative Gift Item Painting 12 inch X 27 inch SANFC12190(multi),Home Decor,1449,PRD11411
"Wall1ders 40 Rings Seven Size Mirror Stickers for Wall, Acrylic Mirror Wall Decor Sticker, Wall Mirror Stickers, Acrylic S",Home Decor,999,PRD11412
"Prarthana Camphor, White, 100 Gram",Home Decor,200,PRD11413
SAYKHUS Acrylic Digital LED Display Number Clock Works on Electricity Table Wall Hanging Alarm Clock White,Home Decor,999,PRD11414
"Real Touch Nowras Royal Arabic Bakhoor Incense - Black Wood Chips Perfect for Prayer, Namaaz, Ceremony, Meditation, Relaxa",Home Decor,699,PRD11415
"Rangoli Vinyl Modern Art Wall Sticker 1.96 x 20.86 x 1.96 Inches, Multicolour, Standard (Modern Art421),",Home Decor,799,PRD11416
"Natali Traders Polyresin Baby Hat Monk Buddha Idols Standard Multicolour, 4 Pieces-Car Dashbord-Home Decor",Home Decor,699,PRD11417
Brahmz Set of 3 Regular Ceramic Aroma Burner Oil Diffuser with Tealight,Home Decor,699,PRD11418
Captain Gogo Go Skins Smoking Paper Plus Tips (Pack of 22) by Treasure House,Home Decor,2200,PRD11419
"Indianara 3 PC Set of Radha Krishna Art Paintings (1137) Without Glass 5.2 X 12.5, 9.5 X 12.5, 5.2 X 12.5 inch (Indr1137)(",Home Decor,1200,PRD11420
VRB Dec 1 Pcs Artificial Eucalyptus Artificial Eucalyptus Flower Sticks for Home Decoration  Faux Flowers for Vases  Dec,Home Decor,1199,PRD11421
"Set of 7 Wall Hangings for Home Decoration with LED Tea Lights, Diwali Lights, Home Living Dcor, Handmade Diwali Decoratio",Home Decor,1899,PRD11422
Shopeum Brass Akhand Diya with Borosilicate Glass (Brass Diya) (Golden Extra Large),Home Decor,1999,PRD11423
Rangoli Large Modern Art Wall Sticker Mullticolor Vinyl Sticker 40cm or 50 cm Pack of 1,Home Decor,799,PRD11424
Zove Metal Wall Art Iron Wall Hanging Home Decoration Perfect for Living Room/Hotel/Restaurant/Bedroom (Color : Multi) (Si,Home Decor,12999,PRD11425
"Decals Design Cute Singing Birds Wall Sticker (PVC Vinyl, 50 cm x 70 cm, Multicolour)",Home Decor,664,PRD11426
"PRARTHANA Sandal Chandan Backflow Incense Dhoop Cones 100 Pcs for Fragrance, Buddha, Backflow Burner, Ganesh, Smoke Fountain",Home Decor,390,PRD11427
Betala Fragrance Guggal Sambrani Dhoop Powder Pack of 250 g Dhoop Powder with Dhoop Burner Plate Use This Dhup Powder for ,Home Decor,299,PRD11428
AERINA ACRYLIC WORLD Foam DIY Creative 3D Stickers Analogue Plastic Wall Clock ( 1108 Deer ),Home Decor,999,PRD11429
"Coolkart Orchid Flower Cherry Peach Blossom Flower Bunch for Vase for Home Decor,Office Decor (Orange)",Home Decor,699,PRD11430
TASMAX plastic mirror for wall sticker mirror stickers for wall mirror stickers mirror stickers for wall bathroom mirror s,Home Decor,999,PRD11431
"eCraftIndia Rajasthani Camel Ceramic Door Hanging (5 cm x 5 cm x 97 cm, Set of 2)",Home Decor,799,PRD11432
UJEAVETTE 24Pcs Colorful Easter Egg Home Decor Ornaments Mini-Eggs Multi-Color Holiday,Home Decor,1814,PRD11433
"Vintage Product Antique Vintage Black Railway Station Double Sided Metal Wall Clock (8 Inch, Black), Standard",Home Decor,2500,PRD11434
JMD GLOBAL SALES Oxygen -Cigarette Ashtray for Car/Home/Office,Home Decor,699,PRD11435
Vprint Sai Baba ji Car Dashboard Idols Figurine Showpiece for car and mandir 3x5 inch (Shirdi Sai Baba Ji)(Acrylic),Home Decor,699,PRD11436
"SATYAM KRAFT 6 Cm Artificial Velvet Rose Flowers Perfect for pooja thali, Fabric Head Rose Flowers For Home Decor, Gift, P",Home Decor,1200,PRD11437
Karigar Creations Wood Wall Hanging Jharokha Mirror Reflection Candle Holder (Size:17x7x1 inch),Home Decor,1999,PRD11438
Art Street Birds Design MDF Plaque Clip Photo Frame Collage Hanging Frame with Wooden Clips with LED Lights - Black - Size,Home Decor,999,PRD11439
"Daedal Dream Catchers Rose Door Set, (Pink)",Home Decor,1651,PRD11440
"SCORIA Herbal Hookah Molasses (100% Nicotine and Tobacco Free) HOOKAH FLAVOR MANGO, STRAWBERRY, GRAPE, BLUE BERRY, VANILL",Home Decor,1350,PRD11441
HOMESUTRAA Hanging Legs Showpiece Family Sitting Dolls Miniature Figurine for Living Room Shelf Home Decor Items (Set of ,Home Decor,1499,PRD11442
"Zed Black Cian Incense Sticks Pack of 5 (in 5 Fragrances of Marine, Rose, Marigold, Lavender and Ivory)",Home Decor,350,PRD11443
Radhika Name Plate for Flat/Home Laser Cut Acrylic Letter on Gold And Black (30.5 x 0.6 x 15.2 Cm.),Home Decor,1299,PRD11444
"HeeMo Traditional Handcrafted Rajasthani Colorful Wooden Face String, Wood Folk Puppets aka Kathputli aka Rajasthani Dolls",Home Decor,599,PRD11445
TIED RIBBONS Door Hanging Bandhanwar Toran - Decoration Items for Home Bandhanwar Toran for Main Door (Multicolor),Home Decor,1499,PRD11446
"Sticker Studio Vinyl PVC Rangoli Floor Sticker, 15.74 x 0.39 x 15.74 Inches, Multicolour",Home Decor,899,PRD11447
URBAN HAAT Prosper Kamdhenu Oxidised Gold Finished The Wish granting Cow and Calf Figurine Decorative Gift Item (Colour Go,Home Decor,500,PRD11448
Nirmalaya 100% Natural Dhoop - Jasmine Fragrance Dhoop Sticks (Bamboo Less - 20 Dhoop Sticks),Home Decor,150,PRD11449
PUFF SMART Al-Maliki VIP-35mm Magic Coal 5 Stick Quick Light Charcoal ( 50 Coals ),Home Decor,599,PRD11450
"Curiofact Wooden Decorative Bowl with Brass Legs, Sheesham Pot Pouri Bowl, Fruit Bowl, Snack Bowl , Serving Bowl, Key Bowl",Home Decor,1249,PRD11451
L.K. RAM Premium Incense Sticks (Agarbatti) /Incense Sticks Loose Packed Lightly Scented Bamboo Agarbatti 1KG (MOGRA),Home Decor,560,PRD11452
"YAJNA Natural Dhoop Sticks - Healthy Incense Stick - Disinfects Air, Repells Mosquitoes - Agarbatti with Camphor, Guggal, ",Home Decor,250,PRD11453
Rangoli Large Modern Art Wall Sticker Mullticolor Vinyl Sticker 40cm or 50 cm Pack of 1,Home Decor,799,PRD11454
MF HANDICRAFTS Handmade Marble Gold Leaf Unique Shapes Paper Weight for Student Desktop Study Table Accessories Positive E,Home Decor,999,PRD11455
UI Intros Moving Sand Art Picture Round Glass 3D Deep Sea Sandscape in Motion Display Flowing Sand Frame Relaxing Desktop ,Home Decor,1899,PRD11456
Nirmalaya 100% Natural Dhoop - Jasmine Fragrance Dhoop Sticks (Bamboo Less - 20 Dhoop Sticks),Home Decor,150,PRD11457
PUFF SMART Al-Maliki VIP-35mm Magic Coal 5 Stick Quick Light Charcoal ( 50 Coals ),Home Decor,599,PRD11458
"Curiofact Wooden Decorative Bowl with Brass Legs, Sheesham Pot Pouri Bowl, Fruit Bowl, Snack Bowl , Serving Bowl, Key Bowl",Home Decor,1249,PRD11459
L.K. RAM Premium Incense Sticks (Agarbatti) /Incense Sticks Loose Packed Lightly Scented Bamboo Agarbatti 1KG (MOGRA),Home Decor,560,PRD11460
"YAJNA Natural Dhoop Sticks - Healthy Incense Stick - Disinfects Air, Repells Mosquitoes - Agarbatti with Camphor, Guggal, ",Home Decor,250,PRD11461
Rangoli Large Modern Art Wall Sticker Mullticolor Vinyl Sticker 40cm or 50 cm Pack of 1,Home Decor,799,PRD11462
MF HANDICRAFTS Handmade Marble Gold Leaf Unique Shapes Paper Weight for Student Desktop Study Table Accessories Positive E,Home Decor,999,PRD11463
UI Intros Moving Sand Art Picture Round Glass 3D Deep Sea Sandscape in Motion Display Flowing Sand Frame Relaxing Desktop ,Home Decor,1899,PRD11464
"FlyBuy Hub (Pack of 5) Stock Market Chart Patterns Poster,Self Adhesive, Trading Charts Poster, Trading Setup (Size 45 cm ",Home Decor,990,PRD11465
Aromatique Lavender Essential Oil For Skin Care and Hair Growth 100% Pure and Natural Therapeutic Grade- 30ml,Home Decor,799,PRD11466
JAAMSO ROYALS Light Pink 3D Magnet Butterefly Self Adhesive Living Room Bedroom Kitchen Décor Wall Sticker (Set of 12),Home Decor,499,PRD11467
"Asian Paints Wall-Ons Floral Creepers Wall Sticker (PVC Vinyl, 0.01 cm x 76.2 cm x 30.48 cm, Multicolour)",Home Decor,365,PRD11468
TFW Single Designer Handcrafted Wooden Temple Home Mandir Perfect for Pooja Room Home Office Wall Mounted Hanging Wooden T,Home Decor,699,PRD11469
Aarcode Night Glowing Stickers Radium Stickers for Bedroom/Kids Room  Glow in The Dark Radium Stars for Ceiling & Decor,Home Decor,999,PRD11470
"Atulya Arts Girls Polyvinyl Chloride Ceiling Star Radium Stickers, Night Glow in The Dark Stars for Ceiling or Wall Stick",Home Decor,999,PRD11471
SPHINX Artificial Marigold Fluffy Flowers and Golden Hanging Bells Torans for Festive Pooja Wedding Housewarming Diwali De,Home Decor,999,PRD11472
"BAREPEPE Digital Alarm Clock with Projector Lamp - FM Radio - Electric Operated, Black (Not Rechargeable)Plastic,Standard",Home Decor,2999,PRD11473
UMAVANSHI Kapoor Dani/Kapoordani/Aroma Oil Burner/Perfume Diffuser/Fragrance Diffuser/Champor Burner/Home Fragrance with N,Home Decor,999,PRD11474
god & gods Large Wall Sticker JUST Peel & Stick Size 50 or 60 cm Pack of 1 (Code GS96,Home Decor,799,PRD11475
"AUROMIN ; THE ART OF INGENUITY Auromin Roman Antique Design Wooden Wall Clock for Living Room, Bedroom Stylish Big Size Wa",Home Decor,1999,PRD11476
"Fourwalls Beautiful Decorative Artificial Lily Flower Bunches for Home décor (60 cm Tall, 18 Flowers, White)",Home Decor,1500,PRD11477
"BS AMOR Flower Glass Vase, Urli Bowl Terrarium Succulent Planter, Air Plant Display, Decorative Centerpiece Floral Contain",Home Decor,599,PRD11478
"EKNOOR Wood Trophy Set of -3 Trophy in 3 Different Color - Gold, SILVAR, Brown in 1 Set for Encourage The School Student, ",Home Decor,249,PRD11479
The Aroma Factory Organic Incense Sticks Saffron Sandal  No Charcoal  100% Herbal  Natural Essential Oils Low Smoke  ,Home Decor,350,PRD11480
AVI 58mm Regular Size Metal Fridge Magnet Blue Dubai UAE Middle East Travel Souvenir MR8002213,Home Decor,319,PRD11481
TIED RIBBONS Water Fountain with LED Light for Living Room Garden Outdoor Tabletop Waterfall Indoor Home Decoration and Gifts,Home Decor,3999,PRD11482
"Two Moustaches Brass European Horse Carriage Showpiece, Standard, Multicolour, Pack of 1",Home Decor,2499,PRD11483
"Magic Stainless Steel Metal Electric Dhoop Kapoor Dani Incense Burner(Useful for Loban, Bakhoor, Oudh, Agarbatti) Black (1)",Home Decor,799,PRD11484
"Borosil Akhand Diya (Small, Nickel)",Home Decor,425,PRD11485
"ArtX Paper Abstract Couple Romantic Wall Paintings For Living Room Decor, Multicolor, 3 Feet x 1.5 Feet, 12.5 X 18.5 inche",Home Decor,1999,PRD11486
Art Street Photo Frame For Wall Decor Hanging Picture Frame For Home and Office Decoration with Free Hanging Accessories (,Home Decor,999,PRD11487
"PAPER PLANE DESIGN Lord Buddha Motivational Poster for Wall Large Size (Size 12 x 18 inch, Set of 10)",Home Decor,399,PRD11488
Anbhudan Jujutsu Kaisen-Japanese manga WALL DECOR  PACK OF 18 Manga wall collage kit Anime wall poster 6 * 4 inches (30,Home Decor,429,PRD11489
Blue Finch Welcome to Our Home Sign Wooden Front Door Decor Welcome Door Hanger Wall Hanging Sign Board for Front Door (Mu,Home Decor,499,PRD11490
"Wonder Plastic Tub 6 Heavy Quality Tub, 1 pc Tub 4 LTR, Green Color, Made in India, KBS01921",Home Decor,350,PRD11491
TINITALO Frameless Decorative Mirror Glass for Wall Mirror Bathrooms Home Mirror Decor Size : 18 x 18 Inch QG 136 (Unframe,Home Decor,2600,PRD11492
MANIAL Cute Baby Girl Poster - Smiling Baby Poster - Poster for Pregnant Women - HD Baby Wall Poster for Room Decor (300GS,Home Decor,499,PRD11493
Balaji Traders Lead Navgrah Chowki,Home Decor,599,PRD11494
"Samrich Female Dress Form Wheel Base Mannequin Statue Premium, Dummy Model Stand ,Display Stand (Black, Size 10)",Home Decor,11999,PRD11495
Rangoli Large Modern Art Wall Sticker Mullticolor Vinyl Sticker 40cm or 50 cm Pack of 1,Home Decor,799,PRD11496
"Golden Decor Black Dog Statue for Vastu and Feng Shui (Size - Medium, 3 pcs) ,Clay",Home Decor,1599,PRD11497
"TIED RIBBONS Set of 2 Mosaic Glass Votives Tealight Candle Holders - Decoration Items for Home (Glass, Pack of 2)- Gifts",Home Decor,899,PRD11498
"CraftVatika Peacock Statue Showpiece Set of 3 for Home Garden Temple Office Shelf Living Room Decoration, Handcrafted Pape",Home Decor,999,PRD11499
"UAPAN Brass Hanging Bell for Festival Home Decoration with J hock (2 Inch, Pack of 12)",Home Decor,1599,PRD11500
Craft Trade Copper Handmade Decorative Sun Surya Idol Face Wall Art Hanging Statue Puja Vastu Figurine for Positivity for ,Home Decor,899,PRD11501
Chidakash Folding Fan Durable Cloth Hand Fan for Women Men Kids Travel Outdoor Indoor Use (Multicolor),Home Decor,299,PRD11502
Shah Fragrances Golden Kasturi Premium Dhoop Sticks Box Packs (Pack of 3*100 Grams),Home Decor,375,PRD11503
"Oasis Acrylic Vase Pot for Indoor Plants and Home Office Decoration, Decorative Flowers (Ginger Clear 9x16cm) 1 No",Home Decor,288,PRD11504
"Art Street Oval Frame Wall Mirror,HD Vanity Make Up Wall Mirror Tiles for Wall Decor (17 x 23 inches, Silver)",Home Decor,2500,PRD11505
"Decals Creation AC Sticker Vinyl Wall Sticker Split Ac Stickers Air Conditioner Sticker Standard Size , Pack of 1",Home Decor,350,PRD11506
"Pure Source India Ceramic Electric Aroma Diffuser for Home, Off White - (10 ml Lemon Grass & Rose Fragrance)",Home Decor,799,PRD11507
"Paddy Rice Toran 3.5 feet is Released on Amazon for Decorative Garlands and Door Ornaments to Attract Positivity, Prosperi",Home Decor,999,PRD11508
"Rangoli Vinyl Religious Wall Sticker Multicolour Vinyl Medium Size 40cm or 50 cm Pack of 1 Sticker, Multicolor, Standard",Home Decor,799,PRD11509
"Dgt 2010 Abs Plastic Digital Chess Clock,for 6+ years,Multicoloured",Home Decor,3500,PRD11510
"GIFTI SKY Wooden Round Rings 1 Inches Set of 100 Rings Natural Smooth Unfinished Wood Circles for Art and Crafts, DIY, Pen",Home Decor,499,PRD11511
100yellow® Friends Forever Wooden Photo Album Scrapbook Memory Book Romantic Love Scrapbook Album Forever LoveSize: 8.5,Home Decor,799,PRD11512
"VELVETEARTH® Classic Crystal Quality Heavy Glass Table Top Ash Tray Indoor Outdoor Home Décor,Design-9",Home Decor,999,PRD11513
"9Dzine Evil Eye Wall Hanging for Vastu Nazar Suraksha Reiki Healing Blue Evil Eye for Home Entrance, Car, Door /Office Evi",Home Decor,1499,PRD11514
"Seven Chakra Natural Healing Gemstone Blastoise Crystal Bonsai Fortune Money Tree for Good Luck, Wealth & Prosperity-Home ",Home Decor,1499,PRD11515
Metier 8 inch Transparent Red Acrylic Mini Smoking Bong.Pipe Diameter 3.0cm (Transparent Red),Home Decor,599,PRD11516
GEBLY Love Lavender Agarbatti Incense Stick Agarbatti (Charcoal Free & 100% Herbal) Bottle Pack of 1 (100g,Home Decor,599,PRD11517
"Wall1ders 9 Curve Square 4 Inch Mirror Wall Decor Sticker, Mirror Wall Sticker, Wall Mirror Stickers, Wall Stickers for Ha",Home Decor,1050,PRD11518
"Casa Rica LAST SUPPER OF JESUS CHRIST Photo Frame Painting Wall Hanging Home Decor for Wall 18""x 30"" Inch set of 5 Mdf (FG",Home Decor,1299,PRD11519
"Techgifti Vinyl Wall Window Door Furniture Tile Car Sticker (Transparent, 70 X 40 cm)",Home Decor,399,PRD11520
Evisha Football Candles Sports Theme Football Birthday Party Candles for Sports Theme Birthday Decoration,Home Decor,299,PRD11521
Mahganya Set of 6 Votive Glass Tealight Candle Holders - Christmas Decorations Items for Home Décor Living Room Bedroom Di,Home Decor,599,PRD11522
Foto Factory Gifts® Personalized Wooden Photo Cutout Caricature with Name Customised Gift for Birthday (Size 10 inch x 8 i,Home Decor,1999,PRD11523
"CC ENTERPRISES Panchmukhi Hanuman Acrylic Wall Frame For South, South-West Main Door, Vastu Dosh Rectification Remedy , Pl",Home Decor,499,PRD11524
Mil9us Fragrance Lamps Kapur Dani Electrical Camphor Diffuser. Glass Kapoor Dani & Essential Oil Diffuser with On Off Swit,Home Decor,699,PRD11525
Herb Tantra- Calm Down Anxiety Relief Roll-On (9 ml)  Ayurvedic Stress Relief Blend  100% Essential Oil Formula  Natura,Home Decor,390,PRD11526
"Zed Black Tin Incense Back Flow Dhoop Cone Combo Pack, Sandal, Arij, Mogra, Rose Flavour Dhoop Cone/Bamboo Free Flavour Sc",Home Decor,1000,PRD11527
Telugu Wedding Pallaki Terachala/Terapatram/Addutera (Without Stone),Home Decor,470,PRD11528
"WallDaddy Fridge Stickers & Wall Stickers, Beautiful Fridge Decorative Sticker Wallpaper Poster (PVC Vinyl) Large Size (60",Home Decor,799,PRD11529
Chaka Chaundh - Compatible bathroom poster - bathroom posters with frame - bathroom quotes framed posters - Washroom Quote,Home Decor,1769,PRD11530
Wolpin Wall Stickers Wallpaper Home Decoration (45 x 300 cm) 3D Effect Bricks Pattern Stylish Office Decor PVC Vinyl Self ,Home Decor,1499,PRD11531
"Techtonemagnetics Flexible Magnetic Sheets (Brown, 2 Pieces, 30Cmx30Cm, 2Mm Thick)",Home Decor,399,PRD11532
VITARA [ Pack of 50 ] Premium Desi Cow Dung Dhoop Batti Organic Incense Stick dhup for Puja and Mosquito Repellent 100% Or,Home Decor,999,PRD11533
"CraftVatika Metal Flower Vase with Crystal Studded, Decorative Golden Metal Flower Vase for Home Office Gift, (6 Inch Height)",Home Decor,999,PRD11534
"Asian Paints Wall-Ons Maroon Motif Wall Sticker (PVC Vinyl, 0.01 cm x 76.2 cm x 30.48 cm, Maroon)",Home Decor,365,PRD11535
SAF Set of 3 Flower Pot UV textured Paintings for living room with frame Painting 12 Inch X 18 Inch SAF-JMS71,Home Decor,899,PRD11536
Handmade Clay Hut Lamp / Tealight / Oil Lamps for Puja (RED),Home Decor,699,PRD11537
"SUVASANE Paddy Torana with Paddy Grains,1 Natural Paddy Door Torana 3.5 feet (1 Paddy Torana Length-42inches) Height-9 inches",Home Decor,899,PRD11538
"Smoking Pipe Cigarette Filter Holder Multi-Filtering to Reduce Tar and Smoke Stains Portable Reusable Food Grade Plastic, ",Home Decor,999,PRD11539
"IRIS 50 Garden Incense (16"",Green)",Home Decor,575,PRD11540
Den Art Flower Metal Wall Art | Modern | Standard (Grey White Gold)07,Home Decor,5400,PRD11541
"Decals Creation Royal Enfield Bike Wall Sticker for Living Room, Bedroom, Kids Room (Size - 50 CM X 80 Cm)",Home Decor,749,PRD11542
SapiS Pure Wax Unscented Pillar Candles (1.5X4 Inches)  Home Decoration Candles  Diwali Candle  Birthday Candle  Vale,Home Decor,400,PRD11543
ExclusiveLane The Elephant Warriors Hand Carved Multi-Utility Tea Box in Sheesham Wood (4 Compartments) -Wooden Box Tea Box,Home Decor,1799,PRD11544
"Rangoli Wood Painting, Multicolour, Abstract, Standard",Home Decor,799,PRD11545
"Generic Feng Shui Owl for Money and Wisdom Showpiece - 10 cm by Make in India, Full (Pro_Pooja_MININ_04), Resin, Golden, 1",Home Decor,499,PRD11546
"RIZIK STORE™ Metal Abstract Figures handcrafted Wall Sculpture wall art multicolor for Home Decoration, Living room, drwai",Home Decor,9999,PRD11547
"Sheer Veda Lavender Oil Essential Oil, Pure, Natural and Undiluted for Skin, Hair and Aromatherapy. (15)",Home Decor,199,PRD11548
Glass Planter Holder Deer |Glass Pot| Glass Flower Pot| Glass Flower Round Vase Handmade for Home Decor [Set of 2] [Gold],Home Decor,1450,PRD11549
Artvibes Motivational Quotes Decorative Wall Art MDF Wall Hanger for Living Room |Artworks Wall Hangings (WH_4412N)(Multi 17),Home Decor,999,PRD11550
"Exploring India Ashok Stambh/Ashoka Pillar Wooden (New Parliament Design,8 inch/21cm, Hand-Carved) (Design 2)",Home Decor,650,PRD11551
"ExclusiveLane Warli Hand-Painted Living Room & Home Decorative Miniature Terracotta Pots Showpiece Set (Small, 7.6 cm x 7.",Home Decor,970,PRD11552
"ArtX Paper Village Women Wall Art Painting, Multicolor, Village, 13 X 22 Inches, Set of 3",Home Decor,442,PRD11553
"Upaharam Customised/Personalized Clear Acrylic Wall Mount Frameless Picture Photo/Poster Frame For Anniversary, Birthday, ",Home Decor,2098,PRD11554
Pixelkari - Personalised Classic Photo Lamp with photos (10 inch)  Best Personalised Anniversary & Valentine Gift Weddin,Home Decor,2099,PRD11555
"Parag Fragrances Fresh Tuberose / Rajnigandha Essential Oil Room Spray / Air Freshner / Room Freshner For Home, Car & Offi",Home Decor,499,PRD11556
Bhimonee Decor by Modern Gift Centre shanku Chakra Namah Stone Work Showpiece for Car Dashboard| Pooja|Puja,Home Decor,599,PRD11557
Phool Lavender Incense Sticks I Pack of 80 Agarbatti I Incense for Good Sleep I Sulpher & Charcoal Free  100% Organic ( 2,Home Decor,245,PRD11558
Enamic UK H-032 Plastic Premium 5 Layer Electric Gold LED Bulb Lights Diya for Pooja Mandir Diwali Festival Decoration -Pa,Home Decor,799,PRD11559
BAKEFY®- Golden 3 Bunch Beery Artificial Berry Stems Christmas Glitter Berries Artificial Fruit Berry Holly Flower Branch ,Home Decor,499,PRD11560
"HC VILLA Exclusive KHATU Shyam JI Murti Fountain Smoke Backflow Cone Incense Holder (12cm Height, Red & Golden) with 10 Fr",Home Decor,799,PRD11561
"Meet Cute Polyvinyl Chloride Kitchen Oil-Proof Temperature Resistant and Waterproof Transparent Wall Sticker (Clear, 60 X ",Home Decor,1050,PRD11562
THE BRIDE MADE Engagement Ring tray ring holder platter King Queen,Home Decor,999,PRD11563
SAF Set of 5 Buddha UV Textured Home Decorative Gift Item MDF Panel Painting 18 Inch X 42 Inch SANFPNL31190,Home Decor,1599,PRD11564
"WallDaddy- Scrapbook Crafts (Wonders Photo) Scrap Book  Wooden Photo Album  40 Black Color Paper Size ""22 X 16 cm"" Woode",Home Decor,799,PRD11565
"Aroma Galaxy Natural Lemongrass Room & Linen Spray - Sheets, Pillow, Fabric, Bed Air Freshener & Deodorizer - Calming Frag",Home Decor,400,PRD11566
S A Manufacture Taj Bowl Hammered Urli Candle Stand with Floating Diya  Urli for Home Decor and Festival Decor Urli Show ,Home Decor,2999,PRD11567
"YOTINO Paper Door Wall Sticker (60 x 500 cm, Transparent)",Home Decor,1850,PRD11568
"SV ENTERPRISE Metal Bong Shooter Pipe, Multicolour (Pack of 2) (8 CM)",Home Decor,599,PRD11569
"Good Hope - Pink Floyd Framed Poster Acrylic Glass for Room & Office (Multicolor, 10 Inch X 13 Inch)",Home Decor,599,PRD11570
"AG Crafts™ A4 (13.75""X9.75"") Picture Photo & Document Frames -0012 (Black)",Home Decor,2499,PRD11571
NIRAJ ART Marble Panchmukhi Hanuman Ji Fengsui Idol for Car Dashboard Showpiece Statue(White)(3-Inch),Home Decor,499,PRD11572
"Lamy Cartridges Refill - Pack of 5, Blue",Home Decor,350,PRD11573
"Wolpin Wall Stickers DIY Botanical Wallpaper Decal (45 x 500 cm) 3D Brick Self Adhesive House Office Decorative PVC Vinyl,",Home Decor,1499,PRD11574
"Pure Source India Rattan & Wicker Spiral Reed Sticks (6 inch, Multicolour)",Home Decor,299,PRD11575
Generic Products Hanture Golden Small Metal Photo Picture Frame Hook Hanger Triangle Ring Single Hole with Screws (P_10) -,Home Decor,449,PRD11576
"Univocean Vinyl PVC Abstract Wall Sticker, 200 x 45 cm, Multicolour",Home Decor,999,PRD11577
"Spefez Kapoor Dani Incense Holder Electric Camphor Burner Beautiful Smart Ceramic Kapur Dani Night Lamp with Switch,Aroma ",Home Decor,999,PRD11578
"Decals Creation Vinyl Botanical Air Conditioner Sticker (1.57x13.77x1.57 inches, Multicolour)",Home Decor,350,PRD11579
"Tej Gifts Microfiber Diamond Studded Umbrella Chhatra with Crystal Hanging for God Idol, Car Dashboard/Office Desk/Table/H",Home Decor,699,PRD11580
WALLSTICKS  Hindu - God - Lord - Siva - Meditating - Shiva - Inspirational - Motivational - Quote - Wall Sticker  - WS12,Home Decor,379.5,PRD11581
Bnezz -16 Big Square Silver Mirror for Wall Stickers Large Size (15x15)Cm Acrylic Mirror Wall Decor Sticker for Bathroom M,Home Decor,999,PRD11582
Airwick Air Freshener Refill 250ml White Flowers,Home Decor,599,PRD11583
Heartily® Navrang Beautiful Wooden Pooja Stand for Home/Mandir for Home/Temple for Home and Office/Puja Mandir for Home an,Home Decor,1499,PRD11584
"BS AMOR Dream Catcher with Lights Wall Hangings, Crafts, Home Decor, Bedroom, Balcony, Garden, Party, Café, Decoration, We",Home Decor,899,PRD11585
