PRODUCT_NAME,CATEGORY,PRICE,PRODUCT_ID
Freny Exim MDF Wooden Gayatri Mantra Decorative Wall Hanging Art Decoration Itam For Home  Living Room  Bedroom  Home D,Home Decor,999,PRD11586
PickEndNow Antique Brass Made Lord Ram Darbar | Religious Indian Art Statue/Idol (lxbxh - 3.0 X 1.0 X 3.2 Inches),Home Decor,999,PRD11587
"Paper Cute Babies / Children Poster, Multicolour, Medium",Home Decor,250,PRD11588
"Vintage Product Victoria Iron Dia Retro Double Sided Station Railway Wall Clock (Black, 8 Inch)",Home Decor,2500,PRD11589
casa rica Allah Muhammad / Masha Allah /Jannat Ka darwaza Islamic Muslim Photo Frame Painting Wall Hanging home decoration,Home Decor,1199,PRD11590
"Himgiri Lavender Aroma Oil for Diffuser, Home Fragrance- 100ml",Home Decor,500,PRD11591
"Design Toscano Chicory The Chimpanzee Baby Monkey Hanging Animal Statue, 16 , Polyresin, Full Color",Home Decor,1999,PRD11592
JAINSONS PET PRODUCTS Copper Water Fountain Power 5W Flow Rate 300L/H MAX height:1/2 MTR (Black Grey),Home Decor,599,PRD11593
AMFIN® Candles for Decoration / Candles for Birthday Theme / Kids Girls Birthday Candle / Mermaid Candle for Decoration / ,Home Decor,599,PRD11594
Garuda Photos - Sri Rama Pattabhishekam Photo Frame, Rama,868,PRD11595
Pure Indian Candle Handpourd Citronella and Camphor Scented Green Tea Light Candle PICTC25002 (Pack of 25 Pcs.),Home Decor,449,PRD11596
COCODOR Basic Scented Reed Diffuser 100ml / Lavender Blue,Home Decor,4500,PRD11597
"Mr.Doctor Bathroom Freshener Fragrance Blocks, Pack of 12, Air Freshener for Toilet, Bathroom, Washroom, Shoe rack. Mix Fr",Home Decor,600,PRD11598
"Windup Fridge Magnet Photo Frame Set (Wave) - 12 Frames per Set - 4 PC 9x6in, 4 PC6.25x4.25 in, 4 PC 4.5x2.5in - Made in I",Home Decor,399,PRD11599
GN 1917 Non-Charcoal Maahi Javadhu sambrani Cups for Pooja  Combo Pack of 2 Boxes  Long Lasting Fragrance  Javadhu Infu,Home Decor,240,PRD11600
Rangoli New Beautiful Peacock & Flower Vase Painting to Décor your Living Spaces Digital Reprint 18 inch x 12 inch,Home Decor,799,PRD11601
"KOTART Paintings Set of 4 Framed Paintings for Wall Decoration, Bedroom - Framed Wall Posters/Paintings for Living Room wi",Home Decor,2999,PRD11602
"DARMIKA Pyramid Meditation Cap for Daily Meditation for Students , Plastic",Home Decor,499,PRD11603
"CraftVatika Adiyogi Shiva Idol Statue for Car Dashboard Small, Adiyogi Statue for Home, Tabletop, OfficeDesk",Home Decor,999,PRD11604
Gifts Culture Paintings Set of 3 Framed Paintings - Framed Wall Posters - Big Size Wall Painting( 20x40 inch ) Multicolor,Home Decor,1899,PRD11605
Proxoto Positive Motivational Quotes Designer Wooden Wall Hanging for Home Office InstituteKitchenLiving RoomGiftsWa,Home Decor,699,PRD11606
Collectible India Ganesha Shubh Labh Metal Toran for diwali / Toran for door latest Fancy / toran for pooja room Mandir / ,Home Decor,999,PRD11607
Ancient Shoppee Wooden 1 Glass Test Tube Home Decor Planter Modern Flower Vase with Wood Stand Plant Propagation,Home Decor,299,PRD11608
"Teak Wood Beautiful MDF Wooden Temple/Pooja Mandir for Home and Office/Wall Mounted Temple/Puja Stand (Brown, Height-46, L",Home Decor,1199,PRD11609
LUXURY DECORATIVE EYE Wooden Beautiful Temple with Led Light Already Assembled Drawer Spacious Multicolor,Home Decor,236,PRD11610
"JAIPUR ACE Happiness Sign Marble Monk Showpieces Best for Gifting Special and Loved Ones for Home Décor & Office, Table- S",Home Decor,1499,PRD11611
"Rangoli Vinyl Vehicles Wall Sticker 1.96 X 20.86 X 1.96 Inches, Multicolour (Model Number: White Glossy Vinyl-0050), Autom",Home Decor,799,PRD11612
Foto Factory Gifts® Personalized Caricature Gifts for Lady Dentist Doctor (wooden_8 inch x 5 inch) CA0234,Home Decor,899,PRD11613
i Creations Personalised Black Matte Nameplate with Golden Acrylic Solid Letters (8 x 12 Inch),Home Decor,1500,PRD11614
Nilgiri Aromas Eucalyptus Natural Pure And Undiluted Essential Oil 60 ML,Home Decor,340,PRD11615
"Zest 4 Toyz Non-Toxic Perfumed Herbal Gulal for Holi Celebration, Skin Friendly, Natural Fragrance Handmade Holi Gulal-Pac",Home Decor,599,PRD11616
"Art Street Set of 5 White Photo Frame With This Is Us MDF Cutout for Home Décor Living Room Wall Decoration (Size - 5X7, 6",Home Decor,2000,PRD11617
Brothers Creation Please Leave Your Shoes and Sliiper Outside Wooden Shoes Hanging for Home Door,Home Decor,269,PRD11618
"Good Hope - Ronaldo CR7 Poster for Room & Office (13 Inch X 19 Inch, Rolled, Sports, Multicolour)",Home Decor,250,PRD11619
Balaji Rose - Pure Rose Sticks - 25 Incense Sticks,Home Decor,380,PRD11620
"ZULU Antique Anchor Pendulam Wall Clock for Living Room Décor Battery Operated Analog Clock for Classroom, Bedroom, Kitche",Home Decor,1199,PRD11621
"SATYAM KRAFT Golden Decorative Net Potli Pouch Basket, Lotus For Multipurpose Use, Traditional Royal Gifting (Pack of 12)",Home Decor,1200,PRD11622
MAGNETICKS 1 Pieces of 50mm x 25mm x 10mm House-Hold & Industrial Magnet,Home Decor,1399,PRD11623
"WAVE TRADERS Metal Nautical Brass Telescope with Wooden Box, Toys for Children (6 inch, Gold and Black)",Home Decor,899,PRD11624
11Delights White Sage Dhoop Sticks.(4inch Long 220 Grams). No Bamboo  No Charcoal  Incense  Pooja  Puja Dhup Batti  ,Home Decor,345,PRD11625
"KARTMEN Vintage Travel Posters, Self Adhesive, Easy Peel and Stick,Retro Landscape/Popular City Posters for Wall Poster (9",Home Decor,1299,PRD11626
Ikea Metal Decoration Elephant Figurine (Gold) -Set of 2,Home Decor,1199,PRD11627
"ADRIAN Wall Clock  Wall Clock for Home  12"" Silent Quartz Decorative Wall Clock Non-Ticking Classic Digital Clock Batter",Home Decor,1299,PRD11628
"GMT 15X3mm Silver disc Shaped Ceramic Magnet for Fridge, Arts, Crafts, DIY Hobby Projects, Office & School Use - 15 pcs",Home Decor,999,PRD11629
"Two Moustaches Gemstone Work Brass Urli Ethnic Traditional Bowl with Bells, Gemstone Work, Material - Brass, Pack of 1",Home Decor,2990,PRD11630
Pure Source India Ceramic Electric Aroma Diffuser Matka Shape Oil Burner with Bulb (Blue - with 10 ml Lavender Aroma Oil),Home Decor,999,PRD11631
"Kitlyn Ram Darbar Statue God Ram, Sita, Laxman & Hanuman Idol for Spiritual Puja Vastu & Gift Item - 21 cm (Polyresin, Mul",Home Decor,3499,PRD11632
"Special You 3D Butterfly for Decoration items for Wall Sticker with Sticking Pad for Home Decoration, Removable Stickers H",Home Decor,1399,PRD11633
LABHCART Metal Decorative Bowl Urli Table Accents for Decoration  Urli Bowl for Home Decor  Gift Item Table Decorative S,Home Decor,999,PRD11634
"URBOII® Designer Wooden Wall Hangings Home Decor Items evil eye turkish evil eye Boho Hamsa Hand for Home, Office, House P",Home Decor,999,PRD11635
Mount Acrylic DIY Frameless 3D Mirror Sticker Large Wall Clock for Home & Office Decorations (Black),Home Decor,999,PRD11636
"HINMIN Smart Night Light Plastic Digital Alarm Clock with Date & Indoor Temperature, Battery Operated Desk Small, Clear LC",Home Decor,1599,PRD11637
"VILASA Aromatheraphy Diffuser Oil for Home & Office Use, Aroma Diffuser, Easy Usage, No Mineral Oil Valley of Flowers",Home Decor,525,PRD11638
"Bikri Kendra - Stars 50 Golden Decorative Mirror Stickers for Wall, Wall Mirror Stickers, 3D Acrylic Stickers Wall Sticker",Home Decor,1199,PRD11639
Little Buddha Monk Solar Head Shaking | Car Home Decoration Figurine Statue Toys,Home Decor,799,PRD11640
Harbour Analog Latest Stylish New Models Wall Clock for Home Living Room Hall Bedroom (Size Height 48 CM X Width 41 CM) Mz,Home Decor,3599,PRD11641
Koshtak Kamdhenu Cow with Brahma Vishnu Mahesh/Shiva Giving Blessing Laminated Poster with Synthetic Wood Golden Frame (30,Home Decor,699,PRD11642
PRINTELLIGENT Wall Art Vintage Wooden Wall Hanging Home Decor Items. (ART) (style-b),Home Decor,999,PRD11643
"Brightown 25FT Black Wire : 25Ft G40 Globe String Lights with Clear Bulbs, ul listed Backyard Patio Lights, Hanging Indoo",Home Decor,2999,PRD11644
"Paper Cute Babies / Children Poster, Multicolour, Medium",Home Decor,250,PRD11645
A F Decor Hanging Murracan Lantern/Tealight Holder with Tealight Candle Hanging Light for IndoorOutdoor Home Décor Pack o,Home Decor,600,PRD11646
Party 24x7 Birthday Party Decoration Star Candle Gold Big Cake Decoration Candles Golden Theme Candle (Gold),Home Decor,299,PRD11647
"STAR WORK Wall Clock - Silent Non-Ticking Wall Clocks Battery Operated - Modern Style Wooden Clock Decorative for Kitchen,",Home Decor,999,PRD11648
ADA Handicraft Premium Lord Goddess God Shankar Family Photo for Pooja  Hindu Bhagwan Devi Devta Shiva Parvati Photo  Go,Home Decor,1499,PRD11649
S2S Lord Ganesh with Gaumata Backdrop Curatin Cloth for Pooja Decoration/House Warming Function/Traditional Events 8 Ft Wi,Home Decor,1199,PRD11650
Rinkon Stockmarket Poster Trading Candlestick Patterns Chart For Traders Stock market Chart Bullish Bearish Sharemarket Tr,Home Decor,1499,PRD11651
"Remedywala Vastu Brass Strip, 8 feet Length, 18mm Width, 0.2 mm Gauge, Gold Color, 1 Piece",Home Decor,999,PRD11652
"Saifee Burhani Wood MFD Masha Allah Islamic Religious Wall and Door Frame (30cmx10cm, Golden, Brown)",Home Decor,799,PRD11653
"Wall1ders Kalash Shubh Labh Mirror Stickers for Wall, Acrylic Mirror Wall Decor Sticker, Wall Mirror Stickers, Acrylic Sti",Home Decor,999,PRD11654
Boxania ® 20 pieces Safe Natural Camphor Wood Balls Moth Balls Bug Mildew Repellent Wardrobe Clothes Drawers Pest Control,Home Decor,449,PRD11655
"Pure Source India Dry Flower Scented Potpourri - 100 Gm, Lavender, Blue",Home Decor,351,PRD11656
Krishi Sai Baba Murti Marble Dust Idol Statue for Pooja (White_4.5 Inch),Home Decor,699,PRD11657
VKR® Digital Smart Back Light Table Mirror Alarm Clock with Sensor Date and Temperature for Office Home and Bedroom - White,Home Decor,999,PRD11658
"PRINTELLIGENT Alphabets Wall Sticker (PVC Vinyl, 130 cm x 130 cm)",Home Decor,1125,PRD11659
Song of India 100 ml. Organic Goodness Air Freshener Room Spray in Amber Coloured Glass Bottle (Mysore Chandan - Sandalwood),Home Decor,450,PRD11660
"Paper Plane Design Coasters Set of 4 Designer Patterns for Home,Bar, Office and Gifting. (A)",Home Decor,745,PRD11661
Anbhudan DEMON SLAYER- DECOR  PACK OF 18 wall collage kit ANIME wall poster 6 * 4 inches  Tanjiro Kamado  Nezuko Kama,Home Decor,429,PRD11662
NATIONAL,Home Decor,237,PRD11663
Akhand Glass Diya with Handi for Pooja | 7 Hour Burn time Borosilicate Glass - 8cm (Small),Home Decor,1050,PRD11664
Elemntl Crescent Moon Gold Tealight Candle Holder Set for Home Decor & Diwali  Tabletop & Hanging  Votive & Tea Light St,Home Decor,999,PRD11665
AVI Rubber Rectangular Fridge Magnet Peach Colorful Taj Mahal Agra Travel Souvenir RFM00067,Home Decor,199,PRD11666
VASTU MAGIC Positive Energy Powder (No Salt),Home Decor,999,PRD11667
Bronto Dhoop Charcoal Tablets (50 Tablets),Home Decor,1499,PRD11668
"Dequera® > Resin Human Skull Ashtray Home Ornaments for Scary Halloween Decorations, Decorative Skulls, Skeletons Figurine",Home Decor,599,PRD11669
"VAH-Kya Bat Hai !! Butterfly Acrylic Wall Art Silver Colour Wall Mirror Stickers For Living Room, Bed Room, Home Decor, In",Home Decor,499,PRD11670
Divine Senses Love Attraction Spell Candle  Natural Soy Wax Manifestation Candle  Spell Candle with Rose Quartz Crystal,Home Decor,999,PRD11671
CraftVatika Metal Toran Ganesha on Leaf Bandarwal Ganesh Kalash subh labh for Door & Wall Hanging Diwali Home Decoration Item,Home Decor,999,PRD11672
"Amazing India Stone Shivling Idol, Standard, White",Home Decor,399,PRD11673
Tdas Artificial Plants with Pot Leaves Hanging Ivy Garlands Plant Greenery Vine Creeper Home Decor Door Wall Balcony Decor,Home Decor,799,PRD11674
PRINTNET Pack of 2 Baby Lord Krishna Wall Poster  HD Poster for room decor (12x18-Inch 300GSM Thick Paper Laminated Mu,Home Decor,499,PRD11675
"JH Gallery Recycled Martial Rajasthani Standing Dolls Tealight Candle Holder, Multicolor (2 Pair)(4 Candle Holders)",Home Decor,899,PRD11676
S-Biv Artificial Plant with Premium Pot  Artificial Rose  Suitable for Home Decoration Office Desk Study Table Artifi,Home Decor,227,PRD11677
"AuraDecor Heart Shape Fragrance Tealight Candles Burning Time 4 to 5 Hours (10, Rose)",Home Decor,449,PRD11678
"BLOOMAX® Original Natural Cedar Wood Blocks, Moth Repellent I Aromatic Cedar Blocks, Clothes Protection Storage Accessorie",Home Decor,899,PRD11679
"Bikri Kendra - 100 Star Golden Decorative Mirror Stickers for Wall, Wall Mirror Stickers, 3D Acrylic Stickers Wall Sticker",Home Decor,1199,PRD11680
"Girirajji Set of 11 Pcs Copper Coin for Pooja, 11 Pcs Copper Coin",Home Decor,999,PRD11681
Revant Handwork ganpati toran for Door Diwali Celebration toran Size 3 feet,Home Decor,999,PRD11682
ACN Kohinoor  WHM-14Beautiful MacrameMirror Wall Hanging Decor  Handmade Boho Wall Hanging Mirror for Home Décoration ,Home Decor,1499,PRD11683
Kapur Dani Electrical Camphor Diffuser Ceramic Kapoor Dhani & Essential Oil Diffuser with On Off Switch to Toggle Between,Home Decor,599,PRD11684
"DreamKraft Glow in The Dark Galaxy of Stars with Moon Radium Night Sticker(Green,231 Pcs)",Home Decor,900,PRD11685
"The Aroma Factory Agarbatti for Pooja, Kesar Chandan & Sandalwood Incense Sticks, Charcoal Free & Low Smoke Agarbatti with",Home Decor,700,PRD11686
Dreamkraft White Metal Antique Finish Tirupati Balaji Vishnu Shankh Chakra Namah Showpiece (Golden - 11 x 1 x 5 cm),Home Decor,700,PRD11687
SUN PACKERS PRE-ROLLED CONES PACK OF 1 BOX NATURAL SMOKING PAPER (Brown),Home Decor,799,PRD11688
Sri Sai Flora Agarbatti Hand Rolled Indian Lord Incense Sticks Pack of 15 (25 GRM Each),Home Decor,675,PRD11689
"Decals Design Vine Flower Wall Sticker (PVC Vinyl, 50 cm x 70 cm, Purple)",Home Decor,664,PRD11690
CraftVatika Marble Dust Goddess Maa Durga Idol Sitting on Lion - 6 .8 Inches,Home Decor,999,PRD11691
"Pure Original Natural Loban - Sambrani-Benzoin Herbal Dhoop - for Pooja, Hawan, Home Fragrance, Dhoop (200 Grams ( Cristal ))",Home Decor,500,PRD11692
"prabhu bhakti Narmadeshwar Shivling Original/Narmada shivling Original for Home for Puja ,Stone ,Brown",Home Decor,1555,PRD11693
Happer Premium Multipurpose Wall Mounted Storage Plastic Cabinet With Mirror (White),Home Decor,7000,PRD11694
"Saumic Craft Set of Five Rajasthani Village Lady Scenery Framed Wall Painting for Home Decoration, Paintings for Wall Deco",Home Decor,2499,PRD11695
Shubhkart Nitya Mini Agarbatti Diya Thali & Haldi-kumkum Kalash Koiri (25g) with Nitya Steel Gruha Ghanti (Medium - 42 Gra,Home Decor,206,PRD11696
Orca 3D Acrylic Wall Clock Design for Living Room Bed Room (Wall Clock1)- Wall Clock -Pack of 50 - Genuine & Original Prod,Home Decor,1299,PRD11697
"Wall Guru PVC Vinyl Flower Branch with Flying Butterfly Wall Sticker 17.71x6.69x6.69 inches, White",Home Decor,999,PRD11698
"Decals Creation Islamic Wall Sticker - Beautiful Floral Masha Allah Wall Sticker for Living Room, Drawing Room, Hall, Offi",Home Decor,599,PRD11699
Sharda Creations SHUBH-LABH Satin Side Door Hangings with Flower Border for Door Decoration/Diwali Decoration(Yellow&Pink),Home Decor,499,PRD11700
"Giant Innovative Bamboo Abstract Poster, Multicolour, Modern, 12 inch x 18 inch",Home Decor,259,PRD11701
Asian Hobby Crafts Dream Catcher Wall Hanging : Size (LxB) 25x8 cm :  Malibu (Combo A),Home Decor,599,PRD11702
Alwaysgifts Magical Mirror Round Shape Customized Photo Frame for Birthday Anniversary Valentine Gift Present,Home Decor,999,PRD11703
"Plus Value Feng Shui Lucky Good Luck Coin (5 Set) for Wealth, Abundance, Prosperity",Home Decor,1000,PRD11704
"ITDC 6"" Handheld Brass Telescope with Wooden Box - Pirate Navigation",Home Decor,599,PRD11705
ARTELLY Wall Hanging for Kitchen Cafe Restaurant Bar Coffee Tea Wall Hanger/Quotes Decor items for Home Kitchen Decoration,Home Decor,699,PRD11706
CELLEBII® Electric Wooden Kapoor Dani Stand/Incense Burner/Dhoop Burner/Camphor Aroma Diffuser with Direct Plug in,Home Decor,299,PRD11707
"Retro Vibes Jasmine Essential oil | Pure, Natural & Undiluted | Pack - 100 ML",Home Decor,899,PRD11708
"wolpin Wall Stickers Wallpaper (45 x 500 cm) Abstract Zebra Pattern Stripes Self Adhesive Decals for Office, Living Room M",Home Decor,1499,PRD11709
the monument shop Gulab jamun Miniature Food 3D Fridge Magnet Best Souvenir Gift 100% Made in India,Home Decor,500,PRD11710
"Krishn ROOP Agarbatti for Home and Office Mogra Home Fragrance Loose Agarbatti 1kg 8"" Stick",Home Decor,699,PRD11711
"eCraftIndia Golden Metal Decorative Handcrafted Tea Light Candle Holder for Diwali Festival, Home Decor, Table Decoration,",Home Decor,699,PRD11712
Interiocrafts Cast Iron Degchi Dhoop Holder and Tea Light Holder for Home with Wall Hanging Stand and Brass Bells (9(L) x ,Home Decor,2499,PRD11713
"Amazon Brand - Solimo 12-Inch Wall Clock, Brown(Plastic)",Home Decor,1100,PRD11714
Devotional Kart Yin Yang Bagua Pa KUA for Toilet / Bathroom / Latrine Vastu and Balancing Energies,Home Decor,300,PRD11715
"AS Interior PVC Plastic Vinyl Self Adhesive Rangoli Attractive Peel and Stick (Multicolour, 23inchx23inch), Pack of 1",Home Decor,388,PRD11716
Color Bristles® 10 Pocket Slide-In Black Brown White Craft Paper Wall Hanging Photo Frame Album with Wooden Clips and Jute,Home Decor,399,PRD11717
SEVEN HORSES Round Shape Frameless Mirror for Bathroom Washbasin for Wall (Small),Home Decor,1998,PRD11718
Ankita Gemstones Marble Shiva Shivling Idol Pooja God Statue (Black),Home Decor,299,PRD11719
Ryme Feng Shui Metal Wind Chimes with Om Printed on Five Pipes for Good Luck (Golden),Home Decor,499,PRD11720
"MANIAL PRINTNET 300GSM Thick Paper, Gloss Laminated HD Smiling Baby Wall Poster Combo for Pregnant Women for Room Decor (1",Home Decor,1299,PRD11721
AJ Arihant Sandalwood/Chandan Incense Dhoop Cones with Stand - Pack of 100  Sandal Dhoop Cone  Chandan Dhoop Cones for P,Home Decor,700,PRD11722
QAZ Genuine Quality Filter Reduce Tar Cleanable and Reusable Recycling Mouthpiece Smoking Cigarette Holder,Home Decor,999,PRD11723
"Incredible Gifts India Gift for Teachers by Students - Personalized Engrave Wooden Award (6 X 4 inches, Wood, Beige), Tabl",Home Decor,1650,PRD11724
"SATYAM KRAFT 1 Pcs Artificial Flowers Gingko Fake Sticks decorative items for Gifting, Home, Room, Office, Bedroom, Balcon",Home Decor,1200,PRD11725
"AFARZA; CHOICE GOOD FEEL GOOD Artificial Mogra Jasmine Flower Toran Garland String for Home Door Decoration (White Red , S",Home Decor,700,PRD11726
"VCREATE DECOR Floral Design PVC Wall Sticker & Decal (Multicolour, Size-58 cm X 41 cm), Botanical",Home Decor,799,PRD11727
Sai Amrut S A Gifts Sadguru Sai Mdf Wooden Momento Acrylic Decorative Sai Baba Photo Frame With Charan Paduka With Natural,Home Decor,999,PRD11728
minimal affairs Designer Leatherette Finish MDF Cash box Jewellery Box Shagun Envelope Money Box Envelope Wedding Gift ret,Home Decor,449,PRD11729
DearHouse 6 Pack 3.75 Feet/Piece Artificial Fake Wisteria Vine Ratta Hanging Garland Silk Flowers String Home Party Weddin,Home Decor,1299,PRD11730
"OREVA Plastic Pendulum Wall Clock (42.5 cm x 30.5 cm x 7.0 cm, Natural Wood, AQ-2327)",Home Decor,570,PRD11731
"UAPAN Brass Door Hanging Bell with Brass Chain for Bandarwal, Temple Decoration, Mandir, Home Decoration(3.5 Feet Long Cha",Home Decor,1499,PRD11732
Udbhav Creations LLP Shock Proof Electric Aroma Burner/ Camphor Diffuser / Fragrance Diffuser for Home / Kapoor Dani Incen,Home Decor,499,PRD11733
CHUNDAWAT Brown Arrow Wall Clock for Living Room || Badroom || Shop || Office || Home Décor_158,Home Decor,899,PRD11734
"HARI DARSHAN Wood Devgandh Sambrani Cups (Pack of 4, 12 Cups in Each)",Home Decor,360,PRD11735
"HASTHIP® Tree of Life Tapestry Wall Hanging, Wishing Tree Aesthetic Tapestries Psychedelic Wall Carpet Mystic Aesthetic Wa",Home Decor,1199,PRD11736
"Amazon Brand - Solimo Collage Rosewood Set of 8 Photo Frames (8 X 10 inch - 8), Wall Mount",Home Decor,1470,PRD11737
"JR Handicrafts World Golden and Silver Plated Bowl Set Includes 2 Bowls, 2 Spoons and 1 Tray",Home Decor,450,PRD11738
"Parashara ARKAM Surya Yantra - Copper - (4 x 4 inches, Brown)",Home Decor,699,PRD11739
"NOVALUC 20 Led Fairy String Lights for Home Decoration, 13FT 10 Crystal Drop and 10 Ball in Sequence (Pack of 1, Warm White)",Home Decor,799,PRD11740
Safari Big Fragrance of Festival (F&F 500g) Tin Container Agarbatti (12in1 Fragrance) Incence Sticks Steel Box 500g Gift Pack,Home Decor,500,PRD11741
NAWAB Essential Aroma Diffuser Oil (Lavender and Ocean - 15ml Each),Home Decor,567,PRD11742
SS Decoration™German Silver Brass Floral Bowl Set with Tray and Spoon with Red Velvet Box Pack Used for Diwali Gifting Dry,Home Decor,899,PRD11743
SAF Set of 3 Hexagon Ganesha MDF Board UV Textured Painting 17 Inch X 17 Inch SANFHXS7500,Home Decor,999,PRD11744
Aarushi Creations Acrylic Personalised Home Door Name Plate Acrylic with Acrylic Embossed Letters with Mirror Shine (Size ,Home Decor,3000,PRD11745
"VR Creatives Brass Handmade Kumkum/Sindoor Box with Stick (Gold, 1.6 X 1.6 X 1.9 Inch), Round Gift",Home Decor,200,PRD11746
"Decopix Split AC Vinyl Wall Stickers (Standard Size, Fit for All Models, Sizes, Brands, Multicolor) - SM6096, Pack of 1",Home Decor,499,PRD11747
Asian Aura Handcrafted Ceramic Electric Square Shaped Aroma Diffuser Oil Burner for Home with Aroma Oils in 2 fragrances (,Home Decor,1999,PRD11748
Art Street Photo Frames for Home Décor Set of 9 Black Wall Photo Frames for Living Room Decoration (Size - 8 x 8 Inches),Home Decor,3500,PRD11749
DND 100% Ayurvedic Herbal Natural Mosquito Repellent Agarbatti | 100% Safe for Humans | Pack of 4 | Basil | Incense Sticks,Home Decor,960,PRD11750
AutoSun-Car Dashboard/Office Desk Alarm Clock and Stopwatch with Flexible Stand,Home Decor,599,PRD11751
Chaka Chaundh - Abdul Kalam Motivational Quotes Poster with Photo Frames for Wall - Engineered Wood - (14 X 11 inches),Home Decor,869,PRD11752
"Textile art Abstract Cotton Wall Hanging Tapestries (54 x 84 inch, Multicolor)",Home Decor,1999,PRD11753
OCB COMBO OF 3 OCB BROWN KING SIZE ROLLING PAPER BOOKLETS AND 3 OCB ROACH PAD BOOKS ( TOTAL PACK OF 6 ) BY BOCACHICA,Home Decor,699,PRD11754
Vintage Collection Non Working Decorative showpiece Telephone DBC7,Home Decor,2400,PRD11755
eCraftIndia Lord Krishna Playing Flute Under Tree with Golden Cow and Calf Showpiece,Home Decor,895,PRD11756
Mirza Decor Tree of Life for Home & Garden Decor for Christmas Decor Wall Decorative Rustic/Antique/Blackish Hangings Beau,Home Decor,799,PRD11757
"CIRCADIAN Ajanta Wooden Hand Painted Designer Wall Clock for Home, Living Room, Office, Bedroom (Black)",Home Decor,1499,PRD11758
"TIED RIBBONS Artificial Hydrangea Flowers Bunch for Vase (43 cm, Pink) Home Décor Living Room Corner Table Top Bedroom Wed",Home Decor,899,PRD11759
"perpetual Radha Krishna Wall Painting For Living Room - Set Of 5, 3d Scenery Wall Painting for Bedroom Large Size with Fra",Home Decor,1699,PRD11760
"HOKIPO Square Bamboo Coaster, Pan Pot Holder, 18 x 18 cm, 4 Piece Set",Home Decor,699,PRD11761
9FT Paper Lamp Lantern Shade for Decoration Hotels Home Diwali Light (10 Inch,Home Decor,555,PRD11762
SP Natural Seashells Home décor for Aquariums/Art Crafts/Table/Garden Decoration (500G),Home Decor,300,PRD11763
"Rangoli Vinyl Modern Wall Sticker 1.96 X 20.86 X 1.96 Inches, Multicolour (Model Number: Modern Art449)",Home Decor,799,PRD11764
S A GIFTS Sai Amrut Vitthal Rukmani Stand  Vitthal Rukmini Idol for Home & Offices Decorative Showpiece (5 Inch Black) ,Home Decor,1200,PRD11765
"SellPlus Black Iron Victoria Station London Vintage Retro Double Sided Antique Wall Clock (L x W x H - 12 x 3 x 12 Inch, M",Home Decor,1999,PRD11766
"DreamKraft Vinyl Flowers Wall Sticker, 11.81 x 11.81 x 0.39 Inches, Multicolour, Botanical",Home Decor,350,PRD11767
"Wall Guru PVC Lord Shiva and Adiyogi Vinyl Wall Sticker Size(59 * 69) cm, 1 Piece, Black, Animal&Botanical&Religion",Home Decor,799,PRD11768
"Collectible India Metal Tirupati Balaji Idol, 9 x 6 x 1.5 Inches, Golden",Home Decor,1299,PRD11769
"CRAFTWAFT Artificial Lily Bunch (Red White) ,Artificial Flora ,(Pack of 1)",Home Decor,899,PRD11770
"Vijyas Terrarium Glass Bubble Bowl, Fish Bowl, Rose Bowl, Rust Resistant Decorative Bowl- Glass Round Vase, Events, Decora",Home Decor,599,PRD11771
Wall Decor Wooden Rectangular Wall Clock with Acrylic Numbers (12 Inch),Home Decor,2299,PRD11772
"90 Degree Magic Floating Diya Wicks Candles Tealight, Silver, 100 Pieces, Any Color",Home Decor,400,PRD11773
VVWV® Kitchen Quotes Wooden Spoons Wall Hanging For Home Restaurant Shops Kitchen Wall Decor Gift 3 PCs L X H 5 X 15 Inch,Home Decor,699,PRD11774
Smoking Paper Brown/Unbleached Regular Size Cigarette Rolling Paper (Pack of 5 Booklets)+ Smoking Special 34 Tips (1 Booklet),Home Decor,499,PRD11775
A & S VENTURES A&S Ventures Parad Shivling Pure Quality/Mercury Shivalinga Idol/Original para Shivling Weight 32 Gram for ,Home Decor,899,PRD11776
"Gaumayam Mosquito Incense Stick Repellent Citronella Incense Sticks Garden agarbatti 2 Hour Burning Extra Thick & 9"" Long ",Home Decor,699,PRD11777
Koshtak Panchmukhi Hanuman/bajrangbali ji Giving blessing photo frame with Laminated Poster for puja room temple Worship/w,Home Decor,699,PRD11778
ASSL Temple for Home God Stand for Pooja Room Mandir Wood Devghar Stand for Office and Shop Home (45-32-22-cm) Squre Brown,Home Decor,2199,PRD11779
"HR Enterprises (VR 70 Black) Vitthal Rukmini Statue,Vitthal Rukmani Stand,Idol of God Vitthal Rukmai,Statue for Home Deco",Home Decor,999,PRD11780
Divya Mantra Nazar Battu for Home Entrance Kirtimukha Evil Eye Hanging Antique Decor Ganesh Wall Hangings for Door Decorat,Home Decor,700,PRD11781
S A GIFTS Sai Amrut Italian Marble Dust Ashirwad Hand Sai Baba Idol/Murti for Home and Office Decor/Used in Pooja/Mandir (,Home Decor,1499,PRD11782
"LaDekor Metal Shiv Ling Water Fountain for Home//Office//Garden Décor//Lucky Gift_Height 17""",Home Decor,4500,PRD11783
"BALDAU PRINTS God Krishna Ji Poster For Room |krishna poster | krishna wall poster (Gloss Laminated, 12X18 Inch, 300 GSM) M24",Home Decor,299,PRD11784
