PRODUCT_NAME,CATEGORY,PRICE,PRODUCT_ID
CraftVatika Romantic Love Couple Miniature Statue Showpiece for Gift Husband Wife Girlfriend Boyfriend Girls Boys Home Dec,Home Decor,2999,PRD11785
ANGEL INFINITE Beautiful Designer Wooden Wall Hanging Decoration Item for HomeOfficeGiftLiving RoomBedroomWall Decora,Home Decor,699,PRD11786
"Zest 4 Toyz Non-Toxic Herbal Flower Gulal for Holi Celebration, Skin Friendly, Natural Fragrance Handmade Holi Gulal (Asso",Home Decor,599,PRD11787
"AR Creative Fear Not - Bible Verse Wall Photo Framed Wall Poster, Bible Quotes Print with Frame, Home, Office Decor, Bible",Home Decor,1000,PRD11788
Safal Sleek Numerals Rectangular Wooden Clock with Sweep Mechanism,Home Decor,995,PRD11789
OutonTrip 8 Inch Black and 5 Inch Raasta Smoking Pipe Cleaner Pack of 5 | Stainless Steel | Bong Shooter Cleaner,Home Decor,549,PRD11790
"D Brasso Brass Lotus Shaped Decor Diya 2.5 Inches Set of 2, Home Decoration Item Gift, Lotus Brass Diyas Oil Lamp Pooja, H",Home Decor,1395,PRD11791
Mysore Sandal Agarbathies (Pack Of 6 Box),Home Decor,330,PRD11792
Gitesh Digital Finger Mala Mantra Jap digital counting machine set of 1 pcs,Home Decor,669,PRD11793
Online Quality Store napthalene Balls for Clothes Pantry napthalene Ball napthalene Balls for Clothes Kapoor goli for C,Home Decor,100,PRD11794
R V Essential Pure Ajwain Essential Oil 10ml- Trachyspermum Amoni (100% Pure and Natural Therapeutic Grade),Home Decor,345,PRD11795
"Rooh Dream Catcher ~ White and Brown 4 Tier ~ Handmade Hangings for Positivity ( Can be Used as Home Decor, Gift, Wall Han",Home Decor,599,PRD11796
RANI PARI Set Of 3 MDF Framded UV Coated Buddha Painting (size - 12x18 Inch) For Living Room  buddha painting for home an,Home Decor,899,PRD11797
EpoojaCart ™- Gomati Chakra - Gomti Chakras - Gomathi Chakralu Original (21),Home Decor,299,PRD11798
"BHAJANLAL GREENERY Guggal Sambrani and Loban Cup Dhoop (Brown),24 Cups",Home Decor,500,PRD11799
"Pasabahce Botanica Glass Vase/Fish Bowl 1 Pc, Transparent, 825 ml",Home Decor,418,PRD11800
Elemntl Artificial Croton Plant in Pot for Home Decor (Height: 20 in)  Decoration Items for Living Room  Decorative Tabl,Home Decor,1499,PRD11801
Worship Trading Natural Mix Sea Shell for Jewelry Making Craft Decoration Big Size Half Shape Spiral Shell  Aquarium Deco,Home Decor,1499,PRD11802
Ocb Black Rolling Cigarette Paper Premium Slim King Size 50 Rolling Papers,Home Decor,1199,PRD11803
PAPER PLANE DESIGN Wooden Wall Hanging Home Decor Item. (KITCHEN),Home Decor,999,PRD11804
"RSN Metal Decorative Leaf Ganesh Wall Hanging (3.75x5 inch, Golden)",Home Decor,499,PRD11805
Koshtak Shiva Parvati/Shiv parivar with Ganesh kartikeya ji shivling nandi (6 x 8 inch) Table top stand photo frame with U,Home Decor,699,PRD11806
Koshtak shri Ram darbar/ram sita with laxman and hanuman ji (6 x 8 inch) Table top stand photo frame with Unbreakable Glas,Home Decor,699,PRD11807
Svaroopam® Brass Metal Incense Holder/ Loban Burner/Loban/Dhoop/Dhuni Burner/Incense Burner for Home and Office (loban Bur,Home Decor,999,PRD11808
ExclusiveLane Terracotta Pots Flower Vases for Living Room Terracotta Decorative for Home & Decorative Vase for Home Decor,Home Decor,2035,PRD11809
Nirvana Class Wooden Crafted Coaster Set Of 6 With Coasters Holder For Drink Bar Coaster Tea Coffee Mug Tabletop Barware D,Home Decor,999,PRD11810
Astagandha Chandan Tika Paste - Pack of 2 Tubes,Home Decor,300,PRD11811
MITHILA HANIDCRAFTS Original Black Horse Shoe | Kale Ghode Ki Naal | Very Old Shoe | Good Luck Home for Main Door,Home Decor,297,PRD11812
"Rosemoore Refill Oil for Reed Diffuser, Scented Oil Fragrance for Home, Room,Office & Washrooms - Blue Oud, 200ml",Home Decor,1290,PRD11813
"Soniya Enterprises Wax Smokeless Tealight Candle, Pack of 100, Unscented",Home Decor,899,PRD11814
"Swara Agate 7 Chakra Symbol Engraved Set Healing Stones for Reiki Healing Crystal Healing for Prosperity, Money, Good Luck",Home Decor,699,PRD11815
FRENUTRI Natural Original White and Brown Gomati Chakra for Good Luck 108 pcs…,Home Decor,720,PRD11816
Nirmalaya Bamboo Less Natural Mysore Rooh Rose Dhoop Sticks | Dhoop Sticks for Pooja Natural- 20 Sticks | Dhoop Sticks,Home Decor,150,PRD11817
Decorate India � Pure Brass Dhoop Diya Medium Size 4.5 inch Dhoop Dani Kapoor Aarti Lamp/Dhoop Stand with Wooden Handle,Home Decor,599,PRD11818
Saraswati Yantra/Sarasvati Yantra / 100% Yantra,Home Decor,599,PRD11819
Tiger king Spray,Home Decor,680,PRD11820
Shelcal-M - Strip of 15 Tablets,Home Decor,129.5,PRD11821
AGAAS ENTERPRISES Decorative Diwali Decorative Metal Lotus Style Set Of 3 Tealight Candle Stand/Candle T-light Votive Hold,Home Decor,899,PRD11822
eCraftIndia Pink and Orange Double Sided Crystal Car Ganesha Showpiece,Home Decor,599,PRD11823
Adikala Radha Krishna MDF Engraved Design Wall Plate with Frame DIY Craft,Home Decor,299,PRD11824
"Raj Saurabh Dhoop Sticks - Sandalwood, Pine, Patchouli, Mogra, Kashmiri Rose (Pack of 5 - 40 in Each)",Home Decor,270,PRD11825
"Arohi Art World Wood Name Plate, Beige, 40.64x15.24x0.6 cm",Home Decor,499,PRD11826
THE BESTSELLERS Laser Cut Metal Umbrella Stand with Removable Drip Tray (Black),Home Decor,3999,PRD11827
Artifii Unscented Dried Flowers Leaves Potpourri for Decoration 4 Colors (50 Grams Each) Total Weight 200G - Multicolor,Home Decor,1000,PRD11828
HARRIS & CO. CLOCKMASTERS Metal Silent Sweep Noiseless Technology Wall Clock (14 Inch) Model-Park Lane-Grey,Home Decor,3999,PRD11829
"TIED RIBBONS Artificial Plants with Pot Stand (Green, 1 Feet) Decorative Leaves Plant for Home Decor Living Room Bedroom H",Home Decor,1749,PRD11830
Plantox Shaded Money Plant Indoor in Glass Vase with Multi Color Stones,Home Decor,599,PRD11831
"Sixfire Digital Smart Plastic Alarm Clock with Automatic Sensor, Clock Mirror Clock Table Office Clock with Date Time Temp",Home Decor,999,PRD11832
"PNF® The Kitchen is the heart of home Quote Printed Home Wall Door Sign Hanging (Wooden, 11x9 Inch,brown)-9-5",Home Decor,499,PRD11833
SAF Set of 3 Buddha UV Textured Home Decorative Gift Item Synthetic Frame Painting 13.5 Inch X 22.5 Inch  SANFS30707,Home Decor,1799,PRD11834
YONOTA® Combo of 3 Ajanta Mfg. Battery Operated Plastic Ticking Wall Clock Movement Machine with Hands (Needles : Antique ,Home Decor,749,PRD11835
Blue Nexus Funny quotes posters Wall Poster with Wall Frame Wall Stickers Room Art Poster Painting (Get 25% Off on Buying ,Home Decor,549,PRD11836
"Indoreonline Plastic Rangoli Stencil Combo (4 stencils : 8 inch 4 stencils : 12 inch, Multicolour)",Home Decor,499,PRD11837
PeepalComm Ceramic Buddha Head Aroma Diffuser Air Freshener for Home Office Aroma Oil Burner Lamp Night with Rose and Lave,Home Decor,999,PRD11838
Pooja Creations MATA Vaishno Devi Darbar Idol Best of Gift & Pooja Purpose Unique Statue of polyresin,Home Decor,799,PRD11839
"AR Creative I Can Do All Things - Bible Verse Photo Framed Wall Poster, Bible Quotes Print with Frame, Home, Office Decor,",Home Decor,1000,PRD11840
Recombigen Wooden Sterilized Swab Sticks In Plastic Tubes (Pack of 100 Pieces),Home Decor,900,PRD11841
Kartique Brass Idol Blindfolded Justice Lady Statue Andha Kanoon Murti Themis Sculpture Gold Color Height 9 Inch,Home Decor,3350,PRD11842
ROYAL SWAG King Size Cigarette Tubes With Filter - Cigarette Tube Empty Box Of 100 Tubes  84 mm Cigarette Blank Tubes Wit,Home Decor,599,PRD11843
"Decals Design Underwater Mermaid and Creatures Wall Sticker (PVC Vinyl, 70 cm x 50 cm),Multicolor",Home Decor,664,PRD11844
Karigaari India Playful Radha Krishna Idol in Silver Plated Base (92.5% Pure Silver),Home Decor,999,PRD11845
DIGITAL COMM Adiyogi Dhyana Mudra Idol Fountain with 10 Smoke Backflow Cones,Home Decor,699,PRD11846
Gadgets Wrap Lovely Toilet Stickers DIY Vinyl Home Decor Removable Bathroom Mural Art Waterproof Wallpaper WC Close Stool ,Home Decor,1001,PRD11847
Trendy decor Beautiful Om Design Wooden Religious Wall Hanging Gayatri Mantra  Swastik design Mantra 12*12 Inch  Livin,Home Decor,999,PRD11848
"NoWorries Quote Wall Decals for Home Decor and Living Room Decoration - Easy to Apply Wall Stickers (Size : 48cm x 96cm ""F",Home Decor,599,PRD11849
Mukherjee Handicrafts Terracotta Wall Hanging Showpiece for Home Décor Terracotta Tiles Wall Hanging,Home Decor,799,PRD11850
POUR HOME Red Rose Room Air Freshener Spray - 270ML Each (Pack of 2)  Long-Lasting Fragrance - Reduces Odours - Suitable ,Home Decor,330,PRD11851
Aryshaa Advanced Quality Tobacco Cigarette Holder Filter Cigarettes Mouthpiece Reduce Tar Cigarette Portable Creative Reus,Home Decor,999,PRD11852
Incrizma Wooden Acrylic Allah (SWT) Mohammad (PBUH) Calligraphy Islamic Ramadan Wall Decorations  Arabic Calligraphy  ,Home Decor,999,PRD11853
"Apka Mart The Online Shop Radha Krishna Religious Wall Hanging - 16 Inch Height - Metal Wall Showpiece , Brown, Copper , S",Home Decor,2800,PRD11854
TenorArts Argentina World cup Moment Lionel Messi Poster Laminated Poster Framed Painting with Matt Finish Black Frame (12,Home Decor,699,PRD11855
Dipti Litle Artificial Plants for Home Decor -Best Different Types of Plants (Green) Pack of 4 (4 Set Different Plant) for,Home Decor,999,PRD11856
"SAF Set of 3 Religious Buddha UV Coated Home Decorative Gift Item Self Adeshive Painting 18 Inch X 12 Inch SANFJM31057, Mu",Home Decor,899,PRD11857
"VINAYAKAMART DIY Ganesha for Traditional Backdrop Decoration, Backdrop Ganesha Decoration, Medium 3 Layer, Length - 42 cm,",Home Decor,700,PRD11858
"Betala Fragrance Saffron (Kesar) Flavour Dhoop Sticks for Pooja, Pack of 200 g Dhup Stick with Holder",Home Decor,399,PRD11859
StickMe The Mind is Everything - What You Think You Become -Buddha - Office - Inspirational - Motivational - Quotes - Wal,Home Decor,899,PRD11860
"Amazon Brand - Solimo Medium Grain Cotton Stretched Canvas with Wooden Frame, 18 x 24 inch, Set of 2",Home Decor,1000,PRD11861
Udbhav Creations LLP Electric Ceramic Shock Proof Plug with Auto Cut off ( Power Saver / Temperature Control ) Camphor Dif,Home Decor,599,PRD11862
"Paper Plain Design Self Adhesive Wall Tile Peel and Stick for Kitchen, Wall Sticker (Kitchen Sticker -3)",Home Decor,899,PRD11863
"Rangoli Vinyl Wall Sticker 1.96x20.86x1.96 inches, Multicolour (Model Number: Modern Art306)",Home Decor,799,PRD11864
Aarushi Creations Acrylic Personalized Home Door Name Plate Acrylic with Acrylic Embossed Letters with Mirror Shine (Size ,Home Decor,2000,PRD11865
Navya Export Copper 16 LED Hanging Photo Clip String Lights (Warm White),Home Decor,999,PRD11866
RITUALISTIC Pichwai Iron Wall Art (Multicolor) - Set of 5 |Home Decor | Painting | Divine | Intricate Designs,Home Decor,5499,PRD11867
"Pure Source India Reed Sticks for Diffuser 9 Inch, 20 pcs, Natural White",Home Decor,399,PRD11868
MAHA Pack 20 % More Lighter 5 Layer Lamps for Pooja Room Electric Diya Deepak Light Pooja Diya LED Light Mandir Diya for H,Home Decor,1149,PRD11869
"BALDAU PRINTS God Hanuman Ji Combo Poster Set of 4 Posters (Gloss Laminated, 12X18 Inch, 300 GSM) M16",Home Decor,499,PRD11870
VEENSHI pack of 20 gaming wall poster games poster for room|A4 Size 11.9x8.3 inch 300 GSM Glossy Posters,Home Decor,799,PRD11871
Sehaz Artworks Wall Hangings  decorative items for home  Wall decor / room decor items for living room  Home Decor Item,Home Decor,1499,PRD11872
Next In Crafts Iron Lotus Urli with Stand Pot for Floating Flower/Candle Festive Decor Set of 13 Piece 14/12/10 Size with ,Home Decor,5499,PRD11873
"DOJI 14 LED 3 Meter Fairy String Lights,Plug in String Lights Lights for Christmas,New Year,Indoor Outdoor Decoration(Warm",Home Decor,399,PRD11874
ZEDEF Dental Clinic Wall Poster Self Adhesive - UV Protected PVC Vinyl die Cut Decals 25 cm x 45 cm Dimension,Home Decor,300,PRD11875
"Amazon Brand - Solimo Collage Photo Frames, Set of 3, Tabletop (2 pcs - 4x6 inch, 1 pc - 6x8 inch), Golden ,Synthetic Wood",Home Decor,750,PRD11876
Kivalo Aluminum Incense Burner & Fragrance Paste (Silver),Home Decor,1399,PRD11877
SAF Vintage Rajsthani Village Large Synthetic Framed UV Digital Reprint Painting (14 inch x 20 inch) SANFM5671 (Multicolor),Home Decor,1999,PRD11878
Zed Black Luxury Premium - Pineapple Dhoop Cones - Pack of 12 - Fragrance Dhoop Cones,Home Decor,180,PRD11879
HEM Jasmine Blossom Incense Sticks Pack of 120  Chameli Agarbatti  Floral Fragrance  Agarbatthies for Pooja Freshness,Home Decor,249,PRD11880
Rangoli Large Modern Art Wall Sticker Mullticolor Vinyl Sticker 40cm or 50 cm Pack of 1,Home Decor,799,PRD11881
"Xpression Decor Paper Cute Babies / Children Wall Poster, Multicolour, 12 x 18 inch",Home Decor,250,PRD11882
"Think Positive Quotes Fridge Magnets for Home & Kitchen Decoration (Multicolour, Size 3x2.5inch) Set of 4 by EasyWallPrints",Home Decor,1299,PRD11883
"NAVEED ARTS Jb317 Acrylic Home Door Name Plate - Acrylic, Laser Cut - Personalised / Custom Made, Gold",Home Decor,3500,PRD11884
"pnf® Chai bina chain kaha re Quote Printed Home Wall Door Sign Hanging (Wooden, 11x9 Inch,brown)-102-1",Home Decor,499,PRD11885
TRINITY HANDICRAFTS Taj Bowl Hammered Urli Candle Stand with Floating Diya Urli for Home Décor and Festival Décor Urli Sho,Home Decor,3499,PRD11886
RKPM Paper Wall Photo Frame,Home Decor,999,PRD11887
"Divya Mantra Evil Eye Home Decor Turkish Hamsa Glass Greek Wall Hanging Home, Kitchen Decoration Ornament Nazar Battu Bonc",Home Decor,800,PRD11888
"CraftVatika Complete Rangoli Making Kit Tools, Gift Pack of Rangoli Colour Powder Bottle, Stencil with Candle Diya for Diw",Home Decor,600,PRD11889
"Rangoli Wood Birds Painting, Multicolour, Abstract, 12x19Inch",Home Decor,799,PRD11890
"Zeonely Mart Banana Leaf Curtain Backdrop Decoration Cloth with red Flowers, Size : (8 x 5) feet, (aritaku Backdrop Decora",Home Decor,999,PRD11891
"Shop2Beat Realistic Artificial Silk Wisteria Vine Ratta Silk Hanging Flower Plant for Home Party, Decor and Other Events 6",Home Decor,1500,PRD11892
Return Gift for Wedding/Makarsankranti Handcrafted Decorative Diwali/Navratri Rangoli Set/Christmas Gift Kundan Decoration,Home Decor,699,PRD11893
"Fashion Bizz Swan Pair / Kissing Duck/Love Birds Decorative Showpiece - 12 cm (Aluminium, Gold)",Home Decor,999,PRD11894
TINITALO Frameless Decorative Mirror Glass for Wall Mirror for Bathrooms Mirror in Home Mirror Decor Mirror Size : 12 X 36,Home Decor,3000,PRD11895
"BK Mart Natural Looking Money Plant Bonsai Artificial Plant with Pot(25 cm, Green, Yellow)",Home Decor,599,PRD11896
Reiki Crystal Products Natural Clear Quartz Pyramid for Reiki Healing and Crystal Healing Stone Pyramid Size 30-35 mm Appr,Home Decor,525,PRD11897
"Gomati Ethnic Wood Musician Bawla Set, Standard, Multicolour, 6 Piece.",Home Decor,999,PRD11898
Cardamom Garland,Home Decor,2500,PRD11899
"Smoke Station Chivalry 12 Hookah Shisha Pot 650 Gram Iron (Clear red) 11 inch Glass With Hose, Silicon chillum & Tong",Home Decor,2999,PRD11900
The Furnishing Tree Transparent 65 inches LED/LCD TV Cover PVC Material,Home Decor,949,PRD11901
"STLYZ Marble Tooth Shape Desk Watch/ Paper Weight Tooth Clock Ideal Gift for Dentists Day, Doctors (White)",Home Decor,497,PRD11902
"Bcomfort Ayatul Qursi,Allah Mohammad,Dukan or makan ki khair or barkat ki dua,Lohe Qurani,Surah Yaseen,Four qul Religious ",Home Decor,649,PRD11903
PEACOCKRIDE APPU Puneeth Rajkumar I Kannada Cinema I Wall Decal Extra Large Black (PVC Vinyl),Home Decor,699,PRD11904
WHF Wall Hanging Panel  Wooden Wall Decorative Frame for Living Room  MDF Wall Decor Wooden Frame for Home16x16 inches,Home Decor,1199,PRD11905
"Crackpunk - Candle Stick Chart Pattern (12 + 5 Poster) Stock Market Chart Pattern Sheet Posters, Self Adhesive Trading Set",Home Decor,1449,PRD11906
Plenus  Digital LCD Clock  with Voice Talking Function LED Wall/Ceiling Projection Features Alarm/Snooze/Temperature,Home Decor,1099,PRD11907
LTYNE Spell Candle Decorative Candles Set of 12 (5.5 Inches) (Green),Home Decor,499,PRD11908
"OGU Ghee Diya Batti,Jyot Batti for Pooja Aarti and Special Occasions,Handmade Ghee Diya Batti - Pack of 50 Pcs",Home Decor,699,PRD11909
"Arogamic Deep Sleep Aromatherapy Spray For Insomnia Relief, Prepared Using Therapeutic Grade Essential Oils (8 ml)",Home Decor,349,PRD11910
"PAPER PLANE DESIGN Religious Wall Poster Hanuman Chalisa Size 12 x 18 inch Paper Unframed Multi Colour, Multicolour",Home Decor,499,PRD11911
"Gaukosh 21 Pcs,Hand Made Desi Cow Dung Pure Panchagavya Gobar Diya/Vilakku for Diwali and Pooja",Home Decor,500,PRD11912
"Photojaanic ""Wanna Grow Old with You"" unique quotes Matte Finish magnet set for fridge (3.5 X 3.5 inch, Multicolor )",Home Decor,299,PRD11913
CAPIO ART Wooden Peacock Handprinted Antique Wall Clock for Home Wall Decor Round Handmade Vintage Wall Clock for Study Ro,Home Decor,999,PRD11914
Two Moustaches Brass Ethnic Twin Peacock Design Wall Hanging Diya with Bell (Yellow_4 Inch X 3 Inch X 7.5 Inch),Home Decor,1990,PRD11915
"Kios Digital Smart Backlight Battery Operated Alarm Table Clock with Automatic Sensor, Date & Temperature (White, Pack of 1)",Home Decor,999,PRD11916
"Incredible Gifts India Personalized Beech-wood Photo Plaque Best Retirement for Father, Mother, Boss (7x5 inches, Brown) ,",Home Decor,1950,PRD11917
Sidak Golden Camel Showpiece for Home Decor Wealth and Gifting (Pack of 1Pc),Home Decor,850,PRD11918
"FLIPSSHOPPEE Drink Coasters, Wooden Coasters with Iron Holder, Great for Hot and Cold Drinks Beer Coffee, Tea and Wine Uni",Home Decor,599,PRD11919
"Wall1ders 10 cm Circle 20 Silver, Mirror Stickers for Wall, Acrylic Mirror Wall Decor Sticker, Wall Sticker for Hall Room,",Home Decor,999,PRD11920
"OHM Premium Cigarette Filter Tubes (King Size, Red), Pack of (1)",Home Decor,700,PRD11921
"DecorTwist Brass Superfine Square Traditional Lotus Engraved 3 CM High Brass Pooja Chowki, Chowki for God Idols, Temple De",Home Decor,1249,PRD11922
"Prosperro Lumo Paraffin wax candles , tea light set of 50, 3 hr",Home Decor,399,PRD11923
"JAAMSO ROYALS Multicolour 3D Butterfly PVC Vinyl Self Adhesive Home Decor Wall Sticker, 21 CM X 29.7 CM",Home Decor,699,PRD11924
"Risty Shop High Definition one Piece Luffy Zoro Nami Usopp Sanji Superhero Jujutsu Manga Anime Poster -Designer Merch,matt",Home Decor,499,PRD11925
"PriyadrshanPriyadrshanPanchamukhi Hanuman Wall Sticker Main Door Vastu Dosh Rectification Remedy of Home, Office, with Ext",Home Decor,394,PRD11926
"Giant Innovative Craft Qila Paper Santa Claus Twins Smiling Baby Poster (Multicolor, 12 X 18 Inch)",Home Decor,259,PRD11927
"Wall1ders - Lotus Flower Mirror Stickers for Wall, Acrylic Mirror Wall Decor Sticker, Wall Sticker for Hall Room, Living R",Home Decor,999,PRD11928
TRP The Rolling Paper Unbleached 64 Pre-Rolled Cones 100% Pure Unbleached Wood Pulp Papers Brown,Home Decor,640,PRD11929
NoWorries Floral & Pop art Framed poster for wall decor/Wall paintings with frame Engineered Wood Frame ( 11 inch x 14 inc,Home Decor,1999,PRD11930
"Amazon Brand - Solimo 12-inch Plastic & Glass Wall Clock - Aqua Toon (Silent Movement), Black",Home Decor,1100,PRD11931
Home Decorative Hour Glass Sand Timer 5 Minutes Sand Timer Wooden And Brass Sand Timer For Kitchen Hour Glass Sandglass Cl,Home Decor,999,PRD11932
VEEDAA Bulgarian Lavender Mason Tin Soy Wax Scented Candle (Burns 25 Hours),Home Decor,900,PRD11933
INTERNATIONAL GIFT® Golden Peacock Shape Jesus Symbol 12 cm Car Dashboard Idol Christian Religious Showpiece and Home Deco,Home Decor,1800,PRD11934
Asian Hobby Crafts Dream Catcher Wall Hanging : Size (LxB) 45x15 cm :  Odyssey,Home Decor,400,PRD11935
eCraftIndia Enlightening Sai Baba Matt Textured Framed Synthetic Wood UV Art Painting (35.6 cm x 1.3 cm x 50.8 cm),Home Decor,1469,PRD11936
Shah Fragrances Meditation Combo Zipper Packs Incense Sticks (Pack of 6)(710 GMS),Home Decor,450,PRD11937
"Luxaar Quality Gold Number Candles, Birthday Cake Candles, 5.3 inches Gold Number Cupcake Candle, Birthday Wedding Anniver",Home Decor,499,PRD11938
3A Featuretail Decorative Paper Fan Set for Birthday/Anniversary/Baby Shower/Backdrop Decoration and Paper Fan Craft (Set ,Home Decor,499,PRD11939
"Simran Handicrafts Satyam Crafts Wrought Iron Wall Bracket (18 x 2 x 20cm, Gold)",Home Decor,499,PRD11940
"BHOOLU&GOOLU Plastic Mini Panda Showpiece, Small, Multicolour, 4 Piece",Home Decor,399,PRD11941
iDream Self-Adhesive Mix Disney Princess Stickers Snow White Frozen Cartoon Theme DIY Stickers for Suitcase Laptop Bicycle,Home Decor,599,PRD11942
Minimal Affairs Chanderi Fabric Designer Cash Box for wedding return gift shagun money box - Red,Home Decor,499,PRD11943
Vertical Root Inc Reusable Handmade Colourful Diyas Decoration Items- Set of 4,Home Decor,895,PRD11944
"Inephos Bruce Lee As You Think Quote Poster Art , Grey, 300 GSM Paper, 12 x 18 inch",Home Decor,399,PRD11945
Parag Fragrances Mogra Dhoop Sticks / Dhoop Batti Grade-1 Jar (Pack of 1 x 200Gm) Long Lasting Perfume for 24 Hours Home F,Home Decor,499,PRD11946
Godrej aer Musk After Smoke Home Air Freshener Spray (300 ml) - Pack of 2,Home Decor,338,PRD11947
HIMMUKHI Back Flow Incense Holder shivling Incense Burner with 40  Back Flow Incense Cones Dropping Smoke Fountain Backfl,Home Decor,845,PRD11948
World Fire® Austin Round Hammered Traditional Potpourri Bowl Handcrafted Metallic Gold (12 inch),Home Decor,999,PRD11949
Marble Lord Bholenath Shiv Shiva Idol Statue for Pooja & Gift Mahadev Mahakal Ji Murti Idol Lord Adiyogi Shankara for Home,Home Decor,599,PRD11950
"Kuber Industries 6 Piece Indivisual Photo Frames Set For Home & Office Decoration (Black) Size: 4x6-3 Pc, 5x7-3 Pc, wood, ",Home Decor,1499,PRD11951
"VAS Collection Home Floral MDF Wall Decoration Panel, Wall Decoration Hanging, Wood Carving Wall Decoration Panel for Livi",Home Decor,2499,PRD11952
"AuraDecor Scented Tealight Candles, Pure Wax 20 Pcs (Lavender)",Home Decor,298,PRD11953
"Mr.Doctor Naphthalene Colourfull Balls 400 Gram for Cloth Store,Insecticide,Pantry, Bugs and Moths, Repellant, Scented Sme",Home Decor,499,PRD11954
"Magpie Document Bag Recycled Plastic and Fabric Woollen Pom Pom Door Hanging Torans, Wall Hangings Latkans for Decoration",Home Decor,750,PRD11955
L B LB Sales Wood Triangle Shape Dhoop Batti Stand/Temple Wooden Charcoal/Cone Burner Wooden Incense Holder (Brown)(Conica,Home Decor,380,PRD11956
Rangoli Print Deer MDF Wood Reprint Painting for Home Decoration Unique 12 inch or 18 inch Each Size Painting Set of 3 Mul,Home Decor,799,PRD11957
"90 Degree 3 pcs Wall Mounted Stick Agarbatti Stand Holder Wall Sticky Agarbatti Stand Holder, Hook for puja, Metal, 4.5L X",Home Decor,300,PRD11958
Mangaldeep Temple - Lord Vishnus Favourite Fragrances - 140 sticks (pack of 4),Home Decor,200,PRD11959
Koyas Agarbathi Maya Supreme Sambrani Powder (50+15gm) (Pack of 12),Home Decor,410,PRD11960
"Parag Fragrances Real Dhoop Sticks 250gm Collection No. 2 (Khus, Mogra, Gulab, Agaroud and Sandalwood) for Meditation, Pra",Home Decor,599,PRD11961
AuraDecor Pack of 50 Fragrance Tealight Candles || Spa Candles || 3 Hours Burning Time (Jasmine),Home Decor,1299,PRD11962
"SIA VENDORS� Plain Kitchen Stickers Wall Oil Proof Peel & Stick for Kitchen Tiles Behind Gas Stoves, Sink, Wash Basin, Sti",Home Decor,699,PRD11963
"SheetKart Landscape Tapestries - Aesthetic Bohemian Wall Hanging Tapestry for Bed Room Home Decor, Pack of 2, Beige",Home Decor,999,PRD11964
"Photojaanic ""Wanna Grow Old with You"" unique quotes Matte Finish magnet set for fridge (3.5 X 3.5 inch, Multicolor )",Home Decor,299,PRD11965
CAPIO ART Wooden Peacock Handprinted Antique Wall Clock for Home Wall Decor Round Handmade Vintage Wall Clock for Study Ro,Home Decor,999,PRD11966
Two Moustaches Brass Ethnic Twin Peacock Design Wall Hanging Diya with Bell (Yellow_4 Inch X 3 Inch X 7.5 Inch),Home Decor,1990,PRD11967
"Kios Digital Smart Backlight Battery Operated Alarm Table Clock with Automatic Sensor, Date & Temperature (White, Pack of 1)",Home Decor,999,PRD11968
"Incredible Gifts India Personalized Beech-wood Photo Plaque Best Retirement for Father, Mother, Boss (7x5 inches, Brown) ,",Home Decor,1950,PRD11969
Sidak Golden Camel Showpiece for Home Decor Wealth and Gifting (Pack of 1Pc),Home Decor,850,PRD11970
"FLIPSSHOPPEE Drink Coasters, Wooden Coasters with Iron Holder, Great for Hot and Cold Drinks Beer Coffee, Tea and Wine Uni",Home Decor,599,PRD11971
"OHM Premium Cigarette Filter Tubes (King Size, Red), Pack of (1)",Home Decor,700,PRD11972
"DecorTwist Brass Superfine Square Traditional Lotus Engraved 3 CM High Brass Pooja Chowki, Chowki for God Idols, Temple De",Home Decor,1249,PRD11973
"Prosperro Lumo Paraffin wax candles , tea light set of 50, 3 hr",Home Decor,399,PRD11974
"Risty Shop High Definition one Piece Luffy Zoro Nami Usopp Sanji Superhero Jujutsu Manga Anime Poster -Designer Merch,matt",Home Decor,499,PRD11975
"Giant Innovative Craft Qila Paper Santa Claus Twins Smiling Baby Poster (Multicolor, 12 X 18 Inch)",Home Decor,259,PRD11976
"Wall1ders - Lotus Flower Mirror Stickers for Wall, Acrylic Mirror Wall Decor Sticker, Wall Sticker for Hall Room, Living R",Home Decor,999,PRD11977
TRP The Rolling Paper Unbleached 64 Pre-Rolled Cones 100% Pure Unbleached Wood Pulp Papers Brown,Home Decor,640,PRD11978
Sprqcart Water Floating Smokeless Candles & Lotus Flowers Sensor Led Tea Light Unbreakable for Outdoor and Indoor Festival,Home Decor,999,PRD11979
NoWorries Floral & Pop art Framed poster for wall decor/Wall paintings with frame Engineered Wood Frame ( 11 inch x 14 inc,Home Decor,1999,PRD11980
"Amazon Brand - Solimo 12-inch Plastic & Glass Wall Clock - Aqua Toon (Silent Movement), Black",Home Decor,1100,PRD11981
Home Decorative Hour Glass Sand Timer 5 Minutes Sand Timer Wooden And Brass Sand Timer For Kitchen Hour Glass Sandglass Cl,Home Decor,999,PRD11982
INTERNATIONAL GIFT® Golden Peacock Shape Jesus Symbol 12 cm Car Dashboard Idol Christian Religious Showpiece and Home Deco,Home Decor,1800,PRD11983
Asian Hobby Crafts Dream Catcher Wall Hanging : Size (LxB) 45x15 cm :  Odyssey,Home Decor,400,PRD11984
