PRODUCT_NAME,CATEGORY,PRICE,PRODUCT_ID
RAG28 Wooden Wall Decor Set of 11 (SPW1) Multicolour,Home Decor,799,PRD11001
"ArtX Paper Motivational Wall Frames, Inspirational Quotes Wall Frames For Home Office Study Room Decor, Multicolor Posters",Home Decor,1399,PRD11002
Mahogany Life Vintage Glass Hanging Photo Frame For Wall Decor (5x7 inch)  Transparent Glass and Brass Metal Hanging Pres,Home Decor,901,PRD11003
"Indianara Religious Painting -Synthetic Wood, 27x30.5x1cm, Multicolour (GB5)",Home Decor,499,PRD11004
Lexton 20 Piece Photo Clips String Light Battery Powered (Battery Not Included) for Home Decoration (Warm White),Home Decor,499,PRD11005
Rangoli Large Modern Art Wall Sticker Mullticolor Vinyl Sticker 40cm or 50 cm Pack of 1,Home Decor,799,PRD11006
"Kridaykraft Metal Kuber Deepam Oil lamp for or Bringing Good Luck, Prosperity and Wealth,",Home Decor,800,PRD11007
"Bubble Candle - Cube Soy Wax Candles, Home Decor Candle, Scented Candle Set 2 Pieces, Home Use and Gifting",Home Decor,899,PRD11008
Soul & Scents 120 ml Lavender Reed Diffuser Set  Free 6 Fiber Reed Sticks Toxin Free & Stress Relief  Fine-Living Natur,Home Decor,699,PRD11009
"Ajanta Orpat Time Piece Beep Alarm Clock (Small_140X114X74 Mm, White,Plastic)",Home Decor,599,PRD11010
Homenique Artificial Leaf Money Plant Greenery Fake Hanging Vine Plants Leaf Garland Hanging for Wedding Home Decoration,Home Decor,1350,PRD11011
"SAF Set of 3 Buddha UV Textured Home Decorative Gift Item Painting , 18 Inch X 12 Inch - SANFJM31046, Figures, Religious",Home Decor,899,PRD11012
"Mangaldeep Puja Agarbatti, Sandal, 60 Sticks (Pack of 2)",Home Decor,70,PRD11013
Krisah® 1 pcs Lab Tested ISI Seal Original Sandalwood Scented Processed Mysore Chandan Sticks 30-40 Gram for Puja,Home Decor,1345,PRD11014
"HIVAGI® Aromatherapy Essential Oil Diffuser with Flame Light, 180mL Quiet Mist Humidifiers for Essential Oils Home Aroma A",Home Decor,4000,PRD11015
"Amazon Brand - Solimo Collage Set of 11 Black Photo Frames ( 4 x 6 Inch - 2 & 5 X 5 Inch - 6, 5 X 7 inch - 2 & 8 X 10 inch",Home Decor,770,PRD11016
"Basement Bazaar Mahi Glass Hookah (24.8 cm, Black)",Home Decor,749,PRD11017
Reflekt Premium Hand Soap Sheets (Lavender) - Pack Of 80 Sheets In Storage Tin Box  Moisturising Formula Effective On Ge,Home Decor,599,PRD11018
"PRINTNET Pack of 28 BTS Polaroid photocards Collection for BTS Fans, Multicolour",Home Decor,429,PRD11019
SPHINX Artificial Marigold Fluffy Flowers Garlands Double line Door Toran Set/Door Hangings for Home Office Decoration (Ap,Home Decor,899,PRD11020
Aditya Shopping Electric Ceramic Kapoor Dani/Aroma Oil Burner Cum Night Lamp with Switch Design (Style 03),Home Decor,699,PRD11021
World Fire Home Deco Purifying Brass Dhuna Loban Burner(Round),Home Decor,1400,PRD11022
"natureCRAFTS Wooden Coasters for Drinks Set of 6 with Iron Holder, Wooden and Iron Tea Coaster to Prevent Furniture from B",Home Decor,399,PRD11023
Gopz Flexible Mirror Sheets Self-Adhesive Plastic Mirror Tiles Non-Glass Mirror Stickers for Home Decoration [Size:- 30cm*,Home Decor,499,PRD11024
"Itiha Gudi showpiece with Artificial Upturned Copper Vessel,Orange Saree, Leaf with Supari and Kalash on Wooden Base Gudi ",Home Decor,499,PRD11025
"Adiyogi Shiva Statue for Car Dash Board, Pooja & Gift, Mahadev Murti, Idol, Lord Adiyogi Shankara for home decor",Home Decor,999,PRD11026
DeLush Designs Delush2.4 inch Artificial Plumier Rubric Hawaiian Flower Petals Hair Hat Wreath Floral Hawaiian Foam Frangi,Home Decor,500,PRD11027
"Decals Design Romantic Rose Flowers Wall Sticker (PVC Vinyl, 50 cm x 70 cm, Multicolour)",Home Decor,664,PRD11028
Airkwick Freshmatic Room Freshner Refill 250 ml (Jasmine Blossom),Home Decor,299,PRD11029
"Pindia PVC DIY 3D Butterfly Home Wall Decor Magnet Sticker for Living and Study Room, Fridge, AC, Nursery Decoration(Pink)",Home Decor,258,PRD11030
"Ajanta Quartz Plastic Digital Alarm and Table clock, (8 x 7 x 3.5 cm, White, ODC 190)",Home Decor,940,PRD11031
Webelkart Diya Shape Flower Decorative Urli Bowl for Home Handcrafted Bowl for Floating Flowers and Tea Light Candles Hom,Home Decor,2995,PRD11032
TAZLYN Self Adhesive Mirror for Wall Sticker Mirror Stickers for Wall Mirror Stickers Mirror Stickers for Wall Bathroom Mi,Home Decor,999,PRD11033
"Wallstick Motivational Buddha Quotes Vinyl Wall Stickers (115 cm x 60 cm, Multicolour, 57-3161)",Home Decor,999,PRD11034
iCreations Acrylic Ganesha Customised Home Name Plate (Mirror Gold and Black),Home Decor,799,PRD11035
"AMB Fog Colours Eco-Friendly Fog Color Holi, Stage Performance, Party Decoration, Safe Hand Made in India, 5 Pieces in a Box",Home Decor,499,PRD11036
"OXSAM Digital Smart Back Light Table Mirror Alarm Clock for Office, Home, and Bedroom with Sensor Date and Temperature (Wh",Home Decor,999,PRD11037
Treasure House Mozo - Ultimate Brown Rolling Paper with Filter Tips (Pack of 5) by Treasure House.,Home Decor,450,PRD11038
"Parag Fragrances Herbal & Natural 5 in 1 Dhoop Sticks 250Gm Pack / Rose, Sandalwood, Mogra, Camphor & Kasturi / 50Gram Eac",Home Decor,850,PRD11039
"Seva Decorative sea shells, craft and decorative mix seashells 400gm pack",Home Decor,399,PRD11040
Rajotia crafts Handmade Wooden Gangaur Ishar Figurines Size 16 inch,Home Decor,2999,PRD11041
"Wolpin Wall Stickers Wallpaper Decal (45cm x 10 m) DIY PVC Self-Adhesive Bubbles, Kids Room, Lamination Paper, Office, Hom",Home Decor,1499,PRD11042
Healthbuddy Stoptar Smoking Filter 10 Packs Of 10 Pcs Each,Home Decor,900,PRD11043
"Heart Home Artificial Vine Plant with Plastic Pot (Green, 1 Piece)",Home Decor,319,PRD11044
Chaka Chaundh - Suitable Abdul kalam photo frames for wall - motivational quotes frames - poster with frame - Abdul kalam ,Home Decor,899,PRD11045
RDK Original Sandalwood Sticks Scented Processed Mysore Natural Chandan Wood Lakdi for Pooja Tilak Havan & Beauty (35-45 G,Home Decor,439,PRD11046
HEM Precious Chandan Black Incense Sticks (120 Sticks)  Agarbatti for Pooja Air Purifier & Meditation  Puja Room Items ,Home Decor,249,PRD11047
Zintex Metal Wall Clock for Home Decor and Hall Home Big Size Living Room Hall Bedroom Stylish Clock (Gold) (46x46),Home Decor,,PRD11048
"SATYAM KRAFT Acrylic Dancing Flame Led Tea Light Candle For Home Decoration, Gifting, House, Light For Balcony, Room, Birt",Home Decor,1200,PRD11049
"Pink Pari 2 m Aluminium Foil Stickers, Oil Proof , Kitchen Backsplash Wallpaper Self-Adhesive Wall Sticker Anti-Mold and H",Home Decor,599,PRD11050
Rey Naturals Lavender Essential Oil for HairSkin100% Pure Lavender Oil with Natural Lavandula Angustifolia Extract Calm,Home Decor,300,PRD11051
"Ryme Artificial Wild Grass Plant With Pot For Home And Office Decoration (Set Of 4, 4)( Set Of 4), Green",Home Decor,599,PRD11052
"SADHUSADHYA 21 Shape of Mirror Craft (TOTAL-2100 Pices,100 Piece of Each Shape)",Home Decor,899,PRD11053
TIMESETL Wood Coper Wind Chime for Home Bedroom Balcony Garden Etc. for (Decorate Item),Home Decor,1599,PRD11054
"Blooming Floret Artificial Monstera Plant with Black Pot for Home, Office Decor | 18 Medium Size Leaves Plant with Pot",Home Decor,4000,PRD11055
"Asian Paints Wall-Ons Scootaway Wall Sticker (PVC Vinyl, 0.01 cm x 76.2 cm x 30.48 cm) (AS05M)",Home Decor,365,PRD11056
SAF 7 Horses River Large Framed UV Coated Digital Reprint 14 Inch X 20 Inch Painting (SANFH11) SANFH11(multicolor1),Home Decor,1999,PRD11057
"Ajanta Quartz Plastic Abstract Rectangle Digital Alarm Wall Clock (Black and Brown, 29 cm x 19 cm x 2.5 cm, ODC 130)",Home Decor,1025,PRD11058
"Generic PnF Durga Maa Religious Wood Photo Frames with Acrylic Sheet (Glass) for Worship/Pooja(photoframe,Multicolour,8x6i",Home Decor,499,PRD11059
Pauwer 12 Pack (43.2 FT) Artificial Wisteria Vine Ratta Fake Wisteria Hanging Garland Silk Long Hanging Bush Flowers Strin,Home Decor,999,PRD11060
"HOLD UP Led Vanity Lights for Mirror, Hollywood Style LED Vanity Mirror Lights Kit 10 Dimmable Light Bulbs 3 Color Modes, ",Home Decor,2499,PRD11061
Urban Hamlet Iron Decorative Mirror Wall Mounted Hanging Mirror Sculpture Metal Golden Rose Design Modern Art Mirror for H,Home Decor,4999,PRD11062
Shubhkart Nirmal 5 in 1 Agarbatti Zipper Pack 150grams - 9 Inch Long Sticks (Pack of 2)– 22.86cm Long Sticks (Combo of 2),Home Decor,140,PRD11063
"Painting Mantra Art Street Boulevard Photo Frame Set of 11 Picture Frames for Wall Hanging (8x10-3 pcs, 6x8-8 pcs)-Black a",Home Decor,1399,PRD11064
"Golden bird 7.5 Inch Tall Glass Flower Vases, Bulk Plant Vases,1 Pack Modern Flower Vases for Home Décor, Modern Decorativ",Home Decor,999,PRD11065
Art Street A4 Document Photo Frame set of 2 Black Photo Frames for Home and Office decoration (Photo Size 8 x 12 Inches),Home Decor,799,PRD11066
Vintage Clock Iron Hand-Crafted Large Brass Colour Wall Clock (60 x 60 cm),Home Decor,10596,PRD11067
TIED RIBBONS Door Hanging Bandanwar Toran (101.6 cm X 10.1 cm) - Decoration Items for Home Décor Bandanwar Toran for Main ,Home Decor,599,PRD11068
PRIMESKY Alarm Clock Brass Vintage Twin Bell Table Top Alarm Clock with Night Led Light Display Alarm Clock for Bedroom He,Home Decor,999,PRD11069
Arsalan Arslan Decorative Mirror Wall Mounted Hanging Mirror Sculpture Metal Leaf Design Modern Art Mirror Home Decor (60 ,Home Decor,3999,PRD11070
Oblivion Home Decoration Showpiece - Polyresin Miniature Buddha Monk Figurines Showpiece 6 cm - Pack of 4 (Multicolor),Home Decor,485,PRD11071
"Perpetual Radha Krishna Wall Painting For Living Room - Set Of 5, 3d Scenery Wall Painting for Bedroom Large Size with Fra",Home Decor,1699,PRD11072
Collectible India 3.4-inch Cold Cast Bronze Lord Shiv Idol as Gifts (Multicolour),Home Decor,1899,PRD11073
SAF Panchmukhi Hanuman Framed Acrylic Glass Painting 14 inch x 11 inch SANFR33(Multicolor),Home Decor,999,PRD11074
TIED RIBBONS Ganesha Statue Playing Bansuri with with Wooden Flower Tealight Candle Holder Colorful Stones and Wooden Base,Home Decor,999,PRD11075
Pure Source India Porcelain Relaxing Fragrance Aroma Set with 10 ml Aroma Oil and 4 Tea Light Candles (White),Home Decor,1250,PRD11076
SAF Set of 3 Beautiful Flower Pot UV Textured Self adeshive wall painting for living room with mdf 18 Inch X 12 Inch SANFJ,Home Decor,999,PRD11077
Aviraj (72 Cups) Guggal Dhoop Cup Sambrani Original I Loban Dhoop Cups for Pooja Pack of 6 Tray,Home Decor,1200,PRD11078
FOKRIM Black Marble Self Adhesive Wall Stickers Oil-Proof Waterproof Peel & Stick Contact Wallpaper for Kitchen Living Roo,Home Decor,499,PRD11079
"SAF Watercolor Modern Art Painting (Synthetic, 12 inch x 18 inch, Set of 3) SANFJMA9201-Multicolour",Home Decor,1199,PRD11080
Sohibe Multicolored Birds Handmade Hand Emboss Painted Bird Hanging for Garden Balcony Home Office Cafe Decoration Main Do,Home Decor,999,PRD11081
"Amazon Brand - Solimo 12-inch Plastic & Glass Wall Clock - Melanie (Silent Movement, Black Frame)",Home Decor,1100,PRD11082
SAF 6MM Ganesha Set of 3 Panel Digital Reprint 12 inch x 18 inch Painting SANFJM1003 Multicolor,Home Decor,899,PRD11083
"KUMAR INDUSTRIES Kumar Industries Wall Decorative Iron Flowers (Multicolour)(Artificial, 1.)",Home Decor,2349,PRD11084
"S K D Pure Original Natural Loban (100 gm), Sambrani Benzoin Herbal Dhoop for Pooja, Hawan, Home Fragrance",Home Decor,299,PRD11085
Shubhkart Nirmal Raatrani Agarbatti Zipper and Rajanigandha Agarbatti Zipper - 9 Inch Long Sticks (Combo of 2),Home Decor,130,PRD11086
FIFA World Cup Trophy (Replica),Home Decor,899,PRD11087
BHAJANLAL GREENERY Vastu Hawan Sambrani Cups for Holistic Atmosphere & Fresh Mind. (Pack of 24 Cups),Home Decor,200,PRD11088
Pure Source India Handcrafted Soapstone Aroma Burner Oil Diffuser and 1 Tea Light Candle (Natural) (Natural),Home Decor,999,PRD11089
"Interio Crafts Iron Bird Lantern with Bells and Wall Stand, Lantern with T-Light and Diya Holder for Home and Garden Decor",Home Decor,1999,PRD11090
Titan Contemporary Wooden Finish White Wall Clock with Thermometer & Hygrometer - 30 cm x 30 cm (Medium),Home Decor,1695,PRD11091
FARKRAFT White Donut Vase Ceramic Vase for Pampas Grass Home Decor Items for Living Room Bedroom Accessories Dried Flower ,Home Decor,999,PRD11092
QROUN CERAMICS Islamic Wall Clock Surah Al Ikhlas Acrylic Islamic Clock  Islamic Wall Art Wall Clock Black and Golden Col,Home Decor,450,PRD11093
"Onlinetree 5 in 1 Rose, Sandal, Loban, Mogra, Pineapple Flavour Fragrance Agarbatti/Incense Sticks/for Pooja/Mandir 900 Gram",Home Decor,699,PRD11094
"SOFIX Beautiful Artificial Pink Flower Pot- 40cm (Pink), Artificial Flora",Home Decor,799,PRD11095
THE NILGIRIS EUCALYPTUS OIL & ESSENTIAL OILS DISTILLERY TNEOEOD Pure and Natural Therapeutic Grade A Ooty Eucalyptus Oil 3,Home Decor,300,PRD11096
Amazon Brand - Presto! Naphthalene Balls - 200 g (Pack of 10),Home Decor,1000,PRD11097
Collectible India Brass Diya Lamp Lotus Shape -Decorative Akhand Deepak for Pooja - Set of 2 (Gold_3 X 3 X 1.5 Inches),Home Decor,499,PRD11098
Crafts World Wooden Home Decorative Wall Hanging  Printed Designer Wall Hanging  Home Decor  Wall Hanging For Living Ro,Home Decor,999,PRD11099
"AIR-ROMA Combo of 2 Air Freshener Spray, Fragrance- Rose Original & Jasmine Flower (400ml)",Home Decor,498,PRD11100
"Decals Design Green Autumn Leaves Branch Wall Sticker (PVC Vinyl, 50 cm x 70 cm, Green)",Home Decor,664,PRD11101
3V PRODUCTS: Dasangam Powder 50g | Bhuvaneswari Dasangam Dhoop Powder for Pooja & Home,Home Decor,110,PRD11102
Baburao Fridge Magnet- Pack of 1 Bollywood Theme Fridge Magnets,Home Decor,399,PRD11103
HOKIPO® Eco-Friendly Bamboo Wooden Coasters for Home Pan Pot Holder for Dining Table Heat Pad for Kitchen - Pack of 4 (AR2,Home Decor,449,PRD11104
"DESHABOINA VN Plastic Nazar Suraksha Kawach, Evil Eye Protector, Drishti Bommai, Nazar Battu (Large) for House, Office, Sh",Home Decor,599,PRD11105
"Litleo Artificial Flowers with Wooden Pot (Yellow, 2 Piece)",Home Decor,549,PRD11106
"Pure Source India Aroma Essential Oils 9 Fragrances In 1 Pack, 10 Ml Each, (Fragrances: Lemon Grass, Lavender, Jasmine, Ro",Home Decor,999,PRD11107
Borosil Medium Brass Diffuser (Multicolour) (HDDBBSP0100),Home Decor,995,PRD11108
TIED RIBBONS Green Ficus Artificial Plant with Pot Stand (1 Feet) Natural Looking Artificial Plants for Home Decor Living ,Home Decor,1749,PRD11109
Loop Group ® Wooden Tabletop Makeup Mirror Vanity Table Stand Mirror Swivel Bamboo Mirror for Bedroom Bathroom Desk (Squar,Home Decor,3600,PRD11110
Shri Kanth Art Multi Plate Wooden Wall Hanging  Wall Hanger for HomeDecor Wall Art  Gifts  Office  Wooden Home Decor ,Home Decor,599,PRD11111
CraftVatika Ganesh Idol Murti Statue for Car Dashboard Gift Lord Ganesha Ganpati Idols Showpiece Figurine for Home Pooja R,Home Decor,599,PRD11112
"SN Handicrafts Stone Adiyogi Shiva Mahadev Murti for Car Dashboard, Pooja, Home and Office Decor - 5.35 inch (Matte Black,",Home Decor,999,PRD11113
"Ikea Digital Multi Purpose ABS plastic Alarm Clock for Bedroom, Has Thermometer, Timer, Alarm (White)",Home Decor,611,PRD11114
VRB DecTM Artificial Greenery Ferns Plants Vines Fake Ivy Hanging Flowers Vine Pine Needle Wall Hanging for Home Decor Doo,Home Decor,1249,PRD11115
"PUTHAK Plastic Mallow Vase for Flowers, Unbreakable Vase, 8.5x3.5Inch Ceramic Look Flower Vase, Decorative Modern Floral V",Home Decor,599,PRD11116
"BUYERZONE WITH BZ LOGO BUYERZONE Smart Night Light Plastic Digital Alarm Clock with Date & Indoor Temperature, Battery Ope",Home Decor,999,PRD11117
"ArtX Paper Motivational Wall Frames Quotes Wall Art Painting, Framed Paintings For Home Office Decor, 20 X 20 inches (Comb",Home Decor,1399,PRD11118
Odonil Bathroom Air Freshener Blocks - 150g (75g*2) | Long Lasting Fragrance,Home Decor,624,PRD11119
"VAH-Kya Bat Hai !! Moment Photo Frame Black Colour Self Adhesive Wall Hanging for Bed Room, Living Room, Birthday, him wit",Home Decor,1999,PRD11120
"Plus Value Feng Shui Golden Arowana Fish Strong Wealth Symbol & Protects Mishaps, Troubles Vastu Products Home & Office, F",Home Decor,1500,PRD11121
i Creations Personalised Home Name Plate with Golden Acrylic embossed Letters wooden background (9 x 16 Inch),Home Decor,2499,PRD11122
Oreva Round Plastic Wall Clock (32 cm x 4 cm x 32 cm) White Dial and Silver Rim AQ-1687,Home Decor,525,PRD11123
Gesto LED String Lights - 20 Meter Fairy Lights with 360 Degree Light LED Bulb - Waterproof & Bendable Copper LED Serial L,Home Decor,1999,PRD11124
R Ayurveda Copper Decorative Metal Diya Traditional Diya Urli Tealight Holder Golden Bowl for Floating Flowers and Tea Lig,Home Decor,1599,PRD11125
Air freshener Flowers Block for Bathroom and Toilet 60 gm Each - Pack of 6,Home Decor,499,PRD11126
FOKRIM Black Vinyl Marble Aluminum Foil Kitchen Stickers Oil-Proof Waterproof Self Adhesive Wallpaper PVC Bathroom Wall St,Home Decor,799,PRD11127
"wolpin Wall Stickers Wallpaper (45 x 300 cm) Living Room, Bedroom, Textured Embossed Peony Roses Decal Floral Home Decorat",Home Decor,1499,PRD11128
Glade Touch n Fresh Wild Lavender Refill (12 ml),Home Decor,95,PRD11129
PARKOTA HOUSE Designer Home Décor Ganesh Mantra Wooden Wall Hangings for home living room bedroom-Large Size Multicolor (M,Home Decor,999,PRD11130
Paper Plane Design wall door hanging wooden home decoration item (MUMMY),Home Decor,599,PRD11131
"DECORIA Decor Home Metal Flower Wall Art Decor Large Indoor Wall Hanging Sculptures, Natural Art Home Decoration for Home ",Home Decor,4999,PRD11132
PAPER PLANE DESIGN wall hanging decor home decoration item (FAMILY),Home Decor,699,PRD11133
"JaipurCrafts Webelkart Cast Iron Wall Hanging Showpiece (22.86 x 2.54 x 22.86, Multicolour, Religious)",Home Decor,1799,PRD11134
"GLOBCRATE Wooden Mini Temple for Home and Offfice Wall Mounted, Hanging Pooja Mandir Decoration Shelf Cabinet for Temple W",Home Decor,499,PRD11135
"Good Hope PlexiGlass Food Panda Funny Framed Poster, Multicolor, Print,10 Inch X 13 Inch, Framed",Home Decor,499,PRD11136
Party Propz Rainbow Theme Birthday Decorations - Pack of 54 Happy Birthday Decoration Kit with Pastel Balloons  Golden Fo,Home Decor,999,PRD11137
Gold Art India Gaddi Ganesha Premium polyresin Lord Ganesha for Car Dashboard Ganesha Ganpati Idol God of Success and Luck,Home Decor,1199,PRD11138
"tu casa DW-440-USB-Led Copper Fairy Light, Waterproof(10 MTRS-100 Bulbs) Nickel Finish -Warm White",Home Decor,999,PRD11139
Rangoli New Modern Art Two Aesthetic Beautiful Peacocks Large Wall Sticker Size-50cm*70cm,Home Decor,799,PRD11140
Collectible India Buddha Monk Set of 4 Statue Figurines Showpiece - Cute Mini Buddha Idol Statue for Car Dashboard Table T,Home Decor,599,PRD11141
"TIED RIBBONS Artificial Eucalyptus Flowers Leaves (Set of 5, Green, 40.64 cm) for Vase Home Décor Living Room Bedroom Offi",Home Decor,999,PRD11142
"Old Tree Sandalwood Essential Oil for Aromatherapy, 30 ml",Home Decor,839,PRD11143
HANDCRAFTSZILLA Wooden Wall Clock for Home  Stylish Wall Clock for Home Decor  Vintage Silent Wall Clock for Home  M,Home Decor,1999,PRD11144
"AHN Pranjals House Metal Religious Kanha Playing Flute Wall Hanging 23 inches For Home Decoration, Red",Home Decor,2999,PRD11145
AMFIN® Happy Birthday Letter Candles / 1st Birthday Candle / Happy Birthday Candle for Birthday Theme / Happy Birthday Can,Home Decor,399,PRD11146
"aarna Scented Piller Candle for Home Dcor and Candle Light Dinner, Party, Home (Size 3X3) (Color- White)",Home Decor,999,PRD11147
"Heart Home Roman Number Round Shaped Wooden 10"" Wall Clock (Brown, Standard - 25cm x 25cm)",Home Decor,199,PRD11148
Rangoli Large Modern Art Wall Sticker Mullticolor Vinyl Sticker 40cm or 50 cm Pack of 1,Home Decor,799,PRD11149
"Evil Eye Hanging for Home, Nazar Battu for Home Entrance Diwali Door Hanging Gift - Evil Eye for Car Hanging (8 inch, Blue",Home Decor,2000,PRD11150
"ISKCON Jagannath 108+1 Beads Polished Neem Japa Mala (Medium, Multicolour)",Home Decor,199,PRD11151
"BAASC Stock Market Chart Patterns Poster, Candlestick Chart Pattern Wall Poster, Self Adhesive,Trading Setup for Trader In",Home Decor,799,PRD11152
SF Collection Electric Direct Plug-in Mini Wooden Incense Bakhoor Burner Kapoor Dani Camphor Diffuser for Fragrance Positi,Home Decor,499,PRD11153
Stash-Pro RipperTipper Brown King Size Smoking Rolling Paper 10 Packs of 32 Leafs with 32 Filter Tips Each,Home Decor,1500,PRD11154
Chaka Chaundh - Hard Work Quotes Wall Frames - Success Motivational Posters with Frame - Motivational Quotes Wall Framed P,Home Decor,869,PRD11155
PRAHAJ Upgraded Version - Silver Twin Bell Table Alarm Clock for Heavy Sleepers Non Ticking Wind Up Clock with Night LED L,Home Decor,1499,PRD11156
"MINISO Scent Diffusers,Home Fragrance Flameless Essential Oil with Diffuser Sticks,Fabulous Day Series(Rose Charming,Pink)",Home Decor,450,PRD11157
CraftVatika Pair of Kissing Duck Decorative Showpiece Metal Swan Set Statue for Home Table Office Desk Decoration - Gift f,Home Decor,799,PRD11158
Godrej aer Power Pocket Bathroom Freshener – Sea Breeze (10g) | Lasts up to 30 days | Germ Protection,Home Decor,63,PRD11159
"Okayji Silicone Coasters Colorful Fruit Slices Theme for Coffee and Wine Lovers, Multicolour, 7-Pieces",Home Decor,310,PRD11160
"Fourwalls Beautiful Artificial Polyester and Plastic Tulip Flower Bunch (9 Head Flower, 38 cm Total Height, White, Set of 2)",Home Decor,1000,PRD11161
HiFam Magnetic Hooks for Hanging  Colorful Round Magnetic Hooks Keys Hanger Office  Holds Strong  Kitchen Fridge Refri,Home Decor,699,PRD11162
"RKR Plastic 3D DIY Frameless Designer Self Adhesive Analog Wall Clock with Big Mirror Surface Effect (70 cm X 70 cm, Black)",Home Decor,1999,PRD11163
god & gods Large Wall Sticker JUST Peel & Stick Size 50 or 60 cm Pack of 1 (Code GS422,Home Decor,799,PRD11164
"GKD Coaster Set of 6 Beautiful Wooden Coasters with Proper Coaster Stand Designer Coaster Set Fit for Tea Cups, Coffee Mug",Home Decor,999,PRD11165
AR Handicrafts Unique Sheesham Plate Holder Stand Decorative Showpiece (08 Inch),Home Decor,499,PRD11166
Artvibes Motivational Quote Decorative Wall Art MDF Wooden Wall Hanger for Living Room  Bedroom  Home Decor  Office  G,Home Decor,999,PRD11167
Woogor Feng Shui Crystal Lotus Transparent Multicolor for Positive Energy for Vastu Love Harmony Prosperity Peace Health W,Home Decor,999,PRD11168
"BRIGHTAIL INFRA 1 Box Natural Real Dried Flowers For Art Craft Mixed Soap, Candle, Scrapbook, Diy, Resin Jewellery, Pendan",Home Decor,599,PRD11169
Shubhkart Nitya Brass Prasadam Vastu Nakshi Plate 90g Traditional Bhog Plate for Puja Religious Rituals Gifting Home D,Home Decor,225,PRD11170
"Nestasia Artisanal White Praying Angel Statue with Wings and Smooth Finishing for Decoration, Living Room, Shelf, Mantel, ",Home Decor,2330,PRD11171
"SHIVAMKRAFT 12 Pieces Artificial White Fake Foam Hawaii Frangipani Beach Floating Flowers (White, 12 Pieces)",Home Decor,1200,PRD11172
Kanisha eCrafts Natural Sea Shells Mix Size - Turned Snail for Aquariums/Art and Crafts/Table Decoration (Multicolor) Pack,Home Decor,499,PRD11173
"Pure Copper Coin with Hole for wearing & puja/vesikarn puja vastu puja ghar Shanti puja for Home & Office(Copper, 10 gm)",Home Decor,149,PRD11174
Shri Kant Art Cute Owls Wall and Door Hanging for Home| Office| Living Room| Gift| Wall Decoration,Home Decor,555,PRD11175
ZEXICA® Original Agarbatti for Pooja Fragnance Incense Stick For Puja Mediatation And Negative Energy Remover 400gmAgarba,Home Decor,999,PRD11176
Indianara 4 Piece Set of Framed Wall Hanging Motivational Office Decor Art Prints 8.7 Inch X 8.7 Inch Without Glass(multic,Home Decor,1600,PRD11177
"TIED RIBBONS Artificial Lavender Flower Plant with Pot (Violet, 22.8 cm x 10.1 cm) Home Décor Items for Living Room Balcon",Home Decor,1199,PRD11178
fizzytech Snowflake String Lights 4 Meter 25 LED Lights for Indoor Outdoor Diwali Light for Decoration Operated Waterproof,Home Decor,599,PRD11179
Art Street Decorative Wall Mirror for Home and Bathroom Brown Color Small Size (12 x 14 inch),Home Decor,1000,PRD11180
"SDG Frameless Rectangular Wall Mount Mirror Silver, Size : 18 Inch X 24 Inch, Unframed",Home Decor,2000,PRD11181
Mumbai Doodle Kitchen Fridge Magnet- Pack of 1 Fridge Magnet,Home Decor,399,PRD11182
"Essancia Peppermint Essential Oil For Hair Regrowth, Skin, Face, Cold, Congestion, Steam Inhaler, Insects, Rats Repellent,",Home Decor,499,PRD11183
"SAF 7 Running Horses Vastu UV Textured Wall Painting for Home Decoration, Office, Gym, College Wall decoration Painting 12",Home Decor,999,PRD11184
Apka Mart The Online Shop Ganesh Wall Hanging Metal (Copper 18 Inch) Religious Decor for Home Entrance  Pooja Ghar Gift,Home Decor,2500,PRD11185
Shreeji Relax 240 Citronella Incense Sticks Mosquito Repellent Agarbatti - Herbal and Natural (Pack of 2 Boxes x 12 Pouche,Home Decor,360,PRD11186
"Devdarshan Special Dhoop Large, 20 Sticks in Each Unit (Pack of 24 Units)",Home Decor,720,PRD11187
"Saumic Craft Set Of Five Wall Painting With Frame For Home Decoration, Paintings for Living Room, Scenery for Home Decor (",Home Decor,2499,PRD11188
Tdas Artificial Plants with Pot Leaves Hanging Ivy Garlands Plant Greenery Vine Creeper Home Decor Door Wall Balcony Decor,Home Decor,999,PRD11189
"RHD /Metal Wall Decoration Gingo/Wall Hanging Wall Arts/wall hanging decorative item for Home, restaurant, living room, di",Home Decor,5999,PRD11190
"Divyakosh Yellow Theme Rangoli Mats for Home Decoration,Set of 7, Home Decorative Diya, Diwali Gift Diya,Deepak, Candles, ",Home Decor,1599,PRD11191
JH Gallery Recycled Material Rajasthani Musician Bawla Puppets Idol (7x28 cm Multicolor) -5 Piece (Male Puppets),Home Decor,899,PRD11192
Luxantra Essential Anti Bacterial Aroma Oil for Home Electric and Tlight Diffuser  Home Fragrance  Jasmine Lavender and,Home Decor,1125,PRD11193
Anciently 100% Natural Unpolished Karungali Vel Small | Karungali Vel Original - 3 Inches Height Natural Black 1 Piece,Home Decor,900,PRD11194
REGLET ® 1000 pcs. Multicolour Polymer Gel Magic Crystal Water Beads Jelly Ball for Toy Gun Jelly Beads  Water Ball Kids,Home Decor,499,PRD11195
"CrazyCrafts Metal Motor Bike Miniature Showpiece, Large, Silver",Home Decor,768,PRD11196
